Word,URL
domestic travel insurance policy,https://www.bajajfinserv.in/domestic-travel-insurance-policy
bihar student credit card,https://www.bajajfinserv.in/insights/bihar-student-credit-card
how does virtual credit cards works,https://www.bajajfinserv.in/insights/how-does-virtual-credit-cards-works
credit card contact details,https://www.bajajfinserv.in/credit-card-contact-details
how to apply for bajaj emi card online bajaj finserv,https://www.bajajfinserv.in/insights/how-to-apply-for-bajaj-emi-card-online-bajaj-finserv
home loan faq questions,https://www.bajajfinserv.in/home-loan-faq-questions
credit card supercard faqs,https://www.bajajfinserv.in/credit-card-supercard-faqs
transfer money from credit card to bank account,https://www.bajajfinserv.in/transfer-money-from-credit-card-to-bank-account
emi network aakash institute neet iit jee coaching,https://www.bajajfinserv.in/emi-network-aakash-institute-neet-iit-jee-coaching
smart tips to improve your cibil score,https://www.bajajfinserv.in/insights/smart-tips-to-improve-your-cibil-score
cautionary notice new.pdf,https://www.bajajfinserv.in/cautionary-notice-new.pdf
what is the eligibility for personal loan,https://www.bajajfinserv.in/what-is-the-eligibility-for-personal-loan
how to get personal loan without security,https://www.bajajfinserv.in/how-to-get-personal-loan-without-security
emi network lg washing machines,https://www.bajajfinserv.in/emi-network-lg-washing-machines
shop online dishtv,https://www.bajajfinserv.in/shop-online-dishtv
health insurances faq questions,https://www.bajajfinserv.in/health-insurances-faq-questions
what is working capital turnover ratio,https://www.bajajfinserv.in/what-is-working-capital-turnover-ratio
financial habits business owners should have,https://www.bajajfinserv.in/insights/financial-habits-business-owners-should-have
student credit cards how can i get a student credit card,https://www.bajajfinserv.in/insights/student-credit-cards-how-can-i-get-a-student-credit-card
working capital loans faq,https://www.bajajfinserv.in/insights/working-capital-loans-faq
can you use your eaadhaar card as a proof of identity,https://www.bajajfinserv.in/insights/can-you-use-your-eaadhaar-card-as-a-proof-of-identity
loan against fixed deposit reviews,https://www.bajajfinserv.in/loan-against-fixed-deposit-reviews
privacy policy,https://www.bajajfinserv.in/privacy-policy
rbl world max supercard,https://www.bajajfinserv.in/rbl-world-max-supercard
how to build the right workforce for your small business,https://www.bajajfinserv.in/insights/how-to-build-the-right-workforce-for-your-small-business
how to change billing address on your credit card,https://www.bajajfinserv.in/how-to-change-billing-address-on-your-credit-card
how to change credit card pin,https://www.bajajfinserv.in/how-to-change-credit-card-pin
nri fixed deposit calculators,https://www.bajajfinserv.in/nri-fixed-deposit-calculators
use a bajaj finserv personal loan to consolidate your high interest debt,https://www.bajajfinserv.in/insights/use-a-bajaj-finserv-personal-loan-to-consolidate-your-high-interest-debt
road trip travel insurance application form,https://www.bajajfinserv.in/road-trip-travel-insurance-application-form
rbl credit card statement password,https://www.bajajfinserv.in/rbl-credit-card-statement-password
how to link your aadhaar card with your pan mobile number,https://www.bajajfinserv.in/insights/how-to-link-your-aadhaar-card-with-your-pan-mobile-number
when should you choose personal loan,https://www.bajajfinserv.in/when-should-you-choose-personal-loan
/compound interest and simple interest,https://www.bajajfinserv.in//insights/compound-interest-and-simple-interest
credit card instant payment,https://www.bajajfinserv.in/credit-card-instant-payment
whatsapptermandconditionscreditcardcampainpage.pdf,https://www.bajajfinserv.in/whatsapptermandconditionscreditcardcampainpage.pdf
how to check credit card statement,https://www.bajajfinserv.in/how-to-check-credit-card-statement
emi network vlcc,https://www.bajajfinserv.in/emi-network-vlcc
how to set up your small business office,https://www.bajajfinserv.in/insights/how-to-set-up-your-small-business-office
personal loan vs car loan know the difference,https://www.bajajfinserv.in/personal-loan-vs-car-loan-know-the-difference
business loan eligibility and documents,https://www.bajajfinserv.in/business-loan-eligibility-and-documents
personal loan,https://www.bajajfinserv.in/personal-loan
how to read your credit card statement correctly,https://www.bajajfinserv.in/insights/how-to-read-your-credit-card-statement-correctly
everything you need to know about personal loan for debt consolidation,https://www.bajajfinserv.in/insights/everything-you-need-to-know-about-personal-loan-for-debt-consolidation
how nbfcs are changing the business loan landscape in india,https://www.bajajfinserv.in/insights/how-nbfcs-are-changing-the-business-loan-landscape-in-india
emi network ac air conditioners,https://www.bajajfinserv.in/emi-network-ac-air-conditioners
credit card interest rate,https://www.bajajfinserv.in/credit-card-interest-rate
what is business credit card,https://www.bajajfinserv.in/what-is-business-credit-card
credit card against fd,https://www.bajajfinserv.in/insights/credit-card-against-fd
habits for small business owner to grow in the market,https://www.bajajfinserv.in/insights/habits-for-small-business-owner-to-grow-in-the-market
personal loan what are the fees and charges on a personal loan,https://www.bajajfinserv.in/personal-loan-what-are-the-fees-and-charges-on-a-personal-loan
how to get loan on credit card,https://www.bajajfinserv.in/insights/how-to-get-loan-on-credit-card
rbl credit card statement,https://www.bajajfinserv.in/rbl-credit-card-statement
loan against property for doctors,https://www.bajajfinserv.in/loan-against-property-for-doctors
secured business loan,https://www.bajajfinserv.in/secured-business-loan
media/finance/downloads/whistle blower policy.pdf,https://www.bajajfinserv.in/media/finance/downloads/whistle-blower-policy.pdf
7 facts about maadhaar that you should know,https://www.bajajfinserv.in/insights/7-facts-about-maadhaar-that-you-should-know
best business ideas in india,https://www.bajajfinserv.in/insights/best-business-ideas-in-india
5 must know credit card benefits for every traveller,https://www.bajajfinserv.in/insights/5-must-know-credit-card-benefits-for-every-traveller
rbl credit card offers,https://www.bajajfinserv.in/rbl-credit-card-offers
5 types of short term loans in india,https://www.bajajfinserv.in/insights/5-types-of-short-term-loans-in-india
know all the features and benefits of your bajaj finserv personal loan,https://www.bajajfinserv.in/insights/know-all-the-features-and-benefits-of-your-bajaj-finserv-personal-loan
5 factors that have an impact on your credit score,https://www.bajajfinserv.in/insights/5-factors-that-have-an-impact-on-your-credit-score
5 tips to improve your odds of getting a small business loan,https://www.bajajfinserv.in/insights/5-tips-to-improve-your-odds-of-getting-a-small-business-loan
plan your next vacation at a moments notice with a bajaj finserv personal loan,https://www.bajajfinserv.in/insights/plan-your-next-vacation-at-a-moments-notice-with-a-bajaj-finserv-personal-loan
two and three wheeler loan faqs,https://www.bajajfinserv.in/two-and-three-wheeler-loan-faqs
home loan eligibility calculator,https://www.bajajfinserv.in/home-loan-eligibility-calculator
insurance protection application form,https://www.bajajfinserv.in/insurance-protection-application-form
can you get two personal loans at same time,https://www.bajajfinserv.in/can-you-get-two-personal-loans-at-same-time
fixed deposit,https://www.bajajfinserv.in/insights/fixed-deposit
how to finance your home renovation,https://www.bajajfinserv.in/insights/how-to-finance-your-home-renovation
emi network tcl air conditioners,https://www.bajajfinserv.in/emi-network-tcl-air-conditioners
4 ways to get the best personal loan rate,https://www.bajajfinserv.in/insights/4-ways-to-get-the-best-personal-loan-rate
sports fitness injury insurance pstp,https://www.bajajfinserv.in/sports-fitness-injury-insurance-pstp
how to get rbl credit card,https://www.bajajfinserv.in/how-to-get-rbl-credit-card
pre owned vehicle finance,https://www.bajajfinserv.in/pre-owned-vehicle-finance
go backpacking across new zealand under 6 lakh,https://www.bajajfinserv.in/insights/go-backpacking-across-new-zealand-under-6-lakh
short term personal loan,https://www.bajajfinserv.in/short-term-personal-loan
wallet download application form,https://www.bajajfinserv.in/wallet-download-application-form
fraudulent charges insurance cover,https://www.bajajfinserv.in/fraudulent-charges-insurance-cover
emi network tamron lenses,https://www.bajajfinserv.in/emi-network-tamron-lenses
lower your emi by 45 with a flexi personal loan from bajaj finserv,https://www.bajajfinserv.in/insights/lower-your-emi-by-45-with-a-flexi-personal-loan-from-bajaj-finserv
is it good to apply for personal loan with different banks,https://www.bajajfinserv.in/insights/is-it-good-to-apply-for-personal-loan-with-different-banks
things you need to know about business loans for traders,https://www.bajajfinserv.in/insights/things-you-need-to-know-about-business-loans-for-traders
adventure sports insurance cover,https://www.bajajfinserv.in/adventure-sports-insurance-cover
flexi business loans explained,https://www.bajajfinserv.in/insights/flexi-business-loans-explained
emi network multispeciality hospitals on emis,https://www.bajajfinserv.in/emi-network-multispeciality-hospitals-on-emis
car insurance application form,https://www.bajajfinserv.in/car-insurance-application-form
intraday trading,https://www.bajajfinserv.in/insights/intraday-trading
how to save money on emi each month by consolidating your debt,https://www.bajajfinserv.in/insights/how-to-save-money-on-emi-each-month-by-consolidating-your-debt
emi network sony audio systems,https://www.bajajfinserv.in/emi-network-sony-audio-systems
how to build a successful manufacturing business,https://www.bajajfinserv.in/insights/how-to-build-a-successful-manufacturing-business
pstp_pre_offers_details_ecommerce.pdf,https://www.bajajfinserv.in/pstp_pre_offers_details_ecommerce.pdf
purse care insurance policy,https://www.bajajfinserv.in/purse-care-insurance-policy
fixed deposit/ckyc,https://www.bajajfinserv.in/fixed-deposit/ckyc
how to increase credit card limit,https://www.bajajfinserv.in/how-to-increase-credit-card-limit
emi network washing machine on emi,https://www.bajajfinserv.in/emi-network-washing-machine-on-emi
loan against property fees and interest rates,https://www.bajajfinserv.in/loan-against-property-fees-and-interest-rates
what makes unsecured personal loans popular,https://www.bajajfinserv.in/insights/what-makes-unsecured-personal-loans-popular
emi network emi mobile,https://www.bajajfinserv.in/emi-network-emi-mobile
gold loan faq questions,https://www.bajajfinserv.in/gold-loan-faq-questions
trekking travel insurance application form,https://www.bajajfinserv.in/trekking-travel-insurance-application-form
life insurance faqs,https://www.bajajfinserv.in/life-insurance-faqs
home loan balance transfer,https://www.bajajfinserv.in/home-loan-balance-transfer
used car finance,https://www.bajajfinserv.in/used-car-finance
loan_restructuring_faqs_2021.pdf,https://www.bajajfinserv.in/loan_restructuring_faqs_2021.pdf
monsoon cover insurance policy pstp,https://www.bajajfinserv.in/monsoon-cover-insurance-policy-pstp
fixed deposit/fixed deposit systematic deposit plan,https://www.bajajfinserv.in/fixed-deposit/fixed-deposit-systematic-deposit-plan
6 steps to help your business raise finance,https://www.bajajfinserv.in/insights/6-steps-to-help-your-business-raise-finance
emi network dental care on emi,https://www.bajajfinserv.in/emi-network-dental-care-on-emi
types of fixed deposit,https://www.bajajfinserv.in/videos/types-of-fixed-deposit
loan against property faq questions,https://www.bajajfinserv.in/loan-against-property-faq-questions
emi network,https://www.bajajfinserv.in/insights/emi-network
nri fixed deposit,https://www.bajajfinserv.in/nri-fixed-deposit
credit card terms and conditions,https://www.bajajfinserv.in/credit-card-terms-and-conditions
firecracker insurance cover,https://www.bajajfinserv.in/firecracker-insurance-cover
emi network air conditioners on emi,https://www.bajajfinserv.in/emi-network-air-conditioners-on-emi
what is cibil score,https://www.bajajfinserv.in/what-is-cibil-score
emi network led and lcd tvs on emi,https://www.bajajfinserv.in/emi-network-led-and-lcd-tvs-on-emi
personal loan reviews,https://www.bajajfinserv.in/personal-loan-reviews
emi network onida tv,https://www.bajajfinserv.in/emi-network-onida-tv
4 factors that affect your personal loan interest rates,https://www.bajajfinserv.in/insights/4-factors-that-affect-your-personal-loan-interest-rates
top 5 samsung refrigerators features and prices compared,https://www.bajajfinserv.in/insights/top-5-samsung-refrigerators-features-and-prices-compared
emi network lg air conditioners,https://www.bajajfinserv.in/emi-network-lg-air-conditioners
shop online ease my trip,https://www.bajajfinserv.in/shop-online-ease-my-trip
extended warranty faq,https://www.bajajfinserv.in/extended-warranty-faq
identity theft insurance cover,https://www.bajajfinserv.in/identity-theft-insurance-cover
student credit cards how can i get a student credit card,https://www.bajajfinserv.in/insights/student-credit-cards-how-can-i-get-a-student-credit-card
emi network modular kitchen on emi,https://www.bajajfinserv.in/emi-network-modular-kitchen-on-emi
csr activate,https://www.bajajfinserv.in/csr-activate
need urgent finance for your small business choose a bajaj finserv business loan,https://www.bajajfinserv.in/insights/need-urgent-finance-for-your-small-business-choose-a-bajaj-finserv-business-loan
emi network sony camera,https://www.bajajfinserv.in/emi-network-sony-camera
air conditioner on emi,https://www.bajajfinserv.in/videos/air-conditioner-on-emi
loan against car,https://www.bajajfinserv.in/loan-against-car
emi network health emi card contact details,https://www.bajajfinserv.in/emi-network-health-emi-card-contact-details
advantages of bajaj finserv rbl bank credit card,https://www.bajajfinserv.in/insights/advantages-of-bajaj-finserv-rbl-bank-credit-card
what is travel credit card,https://www.bajajfinserv.in/what-is-travel-credit-card
shop online flipkart,https://www.bajajfinserv.in/shop-online-flipkart
what affects your personal loan approval,https://www.bajajfinserv.in/insights/what-affects-your-personal-loan-approval
check pre approved business loan offer,https://www.bajajfinserv.in/check-pre-approved-business-loan-offer
emi network gym memberships on emi,https://www.bajajfinserv.in/emi-network-gym-memberships-on-emi
flexi personal loans vs term loans which one lowers your emis,https://www.bajajfinserv.in/insights/flexi-personal-loans-vs-term-loans-which-one-lowers-your-emis
shop online samsung,https://www.bajajfinserv.in/shop-online-samsung
store locator,https://www.bajajfinserv.in/store-locator
lifecare services at manipal hospitals,https://www.bajajfinserv.in/lifecare-services-at-manipal-hospitals
fixed deposit/fixed deposit application form,https://www.bajajfinserv.in/fixed-deposit/fixed-deposit-application-form
emi network lg water purifiers,https://www.bajajfinserv.in/emi-network-lg-water-purifiers
4 mistakes to avoid when you avail a debt consolidation loan,https://www.bajajfinserv.in/insights/4-mistakes-to-avoid-when-you-avail-a-debt-consolidation-loan
what are the tax benefits on personal loan,https://www.bajajfinserv.in/what-are-the-tax-benefits-on-personal-loan
what happens if you dont repay personal loan,https://www.bajajfinserv.in/what-happens-if-you-dont-repay-personal-loan
chartered accountant loan,https://www.bajajfinserv.in/videos/chartered-accountant-loan
channel financing,https://www.bajajfinserv.in/channel-financing
fixed deposit,https://www.bajajfinserv.in/fixed-deposit
common mistakes to avoid when you avail a personal loan for used cars,https://www.bajajfinserv.in/insights/common-mistakes-to-avoid-when-you-avail-a-personal-loan-for-used-cars
bajaj finserv rbl bank supercard pay with points,https://www.bajajfinserv.in/insights/bajaj-finserv-rbl-bank-supercard-pay-with-points
6 important things to know before applying for a credit card,https://www.bajajfinserv.in/insights/6-important-things-to-know-before-applying-for-a-credit-card
why you should use a business loan for a business expansion project,https://www.bajajfinserv.in/insights/why-you-should-use-a-business-loan-for-a-business-expansion-project
best ac in india,https://www.bajajfinserv.in/insights/best-ac-in-india
moratorium period in personal loan,https://www.bajajfinserv.in/moratorium-period-in-personal-loan
what is net working capital,https://www.bajajfinserv.in/what-is-net-working-capital
emi network lg televisions,https://www.bajajfinserv.in/emi-network-lg-televisions
rbl bank platinum plus supercard,https://www.bajajfinserv.in/rbl-bank-platinum-plus-supercard
how personal loan can provide you tax benefits,https://www.bajajfinserv.in/insights/how-personal-loan-can-provide-you-tax-benefits
running out of cash so get help with flexi business loans,https://www.bajajfinserv.in/insights/running-out-of-cash-so-get-help-with-flexi-business-loans
how to get no guarantor personal loan for low credit,https://www.bajajfinserv.in/how-to-get-no-guarantor-personal-loan-for-low-credit
tips on how to avoid a business financial crisis,https://www.bajajfinserv.in/insights/tips-on-how-to-avoid-a-business-financial-crisis
5 tips to manage working capital for your trading business,https://www.bajajfinserv.in/insights/5-tips-to-manage-working-capital-for-your-trading-business
upcoming ipo,https://www.bajajfinserv.in/upcoming-ipo
life insurance investment plans application form,https://www.bajajfinserv.in/life-insurance-investment-plans-application-form
emi reduction offer,https://www.bajajfinserv.in/emi-reduction-offer
shop on ecommerce samsung,https://www.bajajfinserv.in/shop-on-ecommerce-samsung
emi network cameras on emi,https://www.bajajfinserv.in/emi-network-cameras-on-emi
emi network sabka dentist,https://www.bajajfinserv.in/emi-network-sabka-dentist
monsoon season 5 tips to stay healthy and safe,https://www.bajajfinserv.in/insights/monsoon-season-5-tips-to-stay-healthy-and-safe
what are the different types of working capital,https://www.bajajfinserv.in/insights/what-are-the-different-types-of-working-capital
list of all the documents you need for a home loan,https://www.bajajfinserv.in/insights/list-of-all-the-documents-you-need-for-a-home-loan
how to make credit card payment,https://www.bajajfinserv.in/how-to-make-credit-card-payment
emi network motorola mobile phones,https://www.bajajfinserv.in/emi-network-motorola-mobile-phones
rbl credit card charges,https://www.bajajfinserv.in/rbl-credit-card-charges
why the bajaj finserv rbl bank supercard is your ideal travel partner,https://www.bajajfinserv.in/insights/why-the-bajaj-finserv-rbl-bank-supercard-is-your-ideal-travel-partner
terms and conditions,https://www.bajajfinserv.in/terms-and-conditions
pilgrimage holiday insurance policy,https://www.bajajfinserv.in/pilgrimage-holiday-insurance-policy
credit card balance what is it and how can you check it,https://www.bajajfinserv.in/insights/credit-card-balance-what-is-it-and-how-can-you-check-it
sdp calculators,https://www.bajajfinserv.in/sdp-calculators
pilgrimage holiday insurance plans,https://www.bajajfinserv.in/pilgrimage-holiday-insurance-plans
fixed deposit/fixed deposit,https://www.bajajfinserv.in/fixed-deposit/videos/fixed-deposit
personal loan disbursal process,https://www.bajajfinserv.in/personal-loan-disbursal-process
how to prepay personal loan,https://www.bajajfinserv.in/how-to-prepay-personal-loan
fixed deposit systematic deposit plan,https://www.bajajfinserv.in/videos/fixed-deposit-systematic-deposit-plan
demat trading account fees and charges,https://www.bajajfinserv.in/demat-trading-account-fees-and-charges
televisions on emi,https://www.bajajfinserv.in/videos/televisions-on-emi
credit card balance what is it and how can you check it,https://www.bajajfinserv.in/insights/credit-card-balance-what-is-it-and-how-can-you-check-it
does bajaj finserv checks cibil to approve personal loan,https://www.bajajfinserv.in/does-bajaj-finserv-checks-cibil-to-approve-personal-loan
mortgage loan,https://www.bajajfinserv.in/mortgage-loan
what is balance transfer and how does it works,https://www.bajajfinserv.in/insights/what-is-balance-transfer-and-how-does-it-works
credit card loan interest rate,https://www.bajajfinserv.in/credit-card-loan-interest-rate
third party two wheeler insurance,https://www.bajajfinserv.in/third-party-two-wheeler-insurance
4 reasons why you may have been declined a credit card,https://www.bajajfinserv.in/insights/4-reasons-why-you-may-have-been-declined-a-credit-card
fixed deposit systematic deposit plan,https://www.bajajfinserv.in/fixed-deposit-systematic-deposit-plan
loan against car application form,https://www.bajajfinserv.in/loan-against-car-application-form
business loan apply form,https://www.bajajfinserv.in/business-loan-apply-form
what is kyc,https://www.bajajfinserv.in/insights/what-is-kyc
how to get personal loan for cibil defaulter,https://www.bajajfinserv.in/how-to-get-personal-loan-for-cibil-defaulter
how to upgrade credit card,https://www.bajajfinserv.in/insights/how-to-upgrade-credit-card
how does the disbursal process for a personal loan work,https://www.bajajfinserv.in/insights/how-does-the-disbursal-process-for-a-personal-loan-work
the best business finance solutions,https://www.bajajfinserv.in/videos/the-best-business-finance-solutions
used car finance with hybrid flexi facility,https://www.bajajfinserv.in/used-car-finance-with-hybrid-flexi-facility
emi network hitachi air conditioners,https://www.bajajfinserv.in/emi-network-hitachi-air-conditioners
flexi loans,https://www.bajajfinserv.in/flexi-loans
washing machine insurance,https://www.bajajfinserv.in/washing-machine-insurance
what are benefits of form 16,https://www.bajajfinserv.in/insights/what-are-benefits-of-form-16
emi network air purifiers,https://www.bajajfinserv.in/emi-network-air-purifiers
how to choose the right personal loan lender,https://www.bajajfinserv.in/insights/how-to-choose-the-right-personal-loan-lender
bad business decisions that every small business owner should avoid,https://www.bajajfinserv.in/insights/bad-business-decisions-that-every-small-business-owner-should-avoid
emi network camera on emi,https://www.bajajfinserv.in/emi-network-camera-on-emi
make down payment of home with personal loan,https://www.bajajfinserv.in/make-down-payment-of-home-with-personal-loan
how to calculate personal loan emi on calculator,https://www.bajajfinserv.in/how-to-calculate-personal-loan-emi-on-calculator
healthcare medical equipment finance,https://www.bajajfinserv.in/healthcare-medical-equipment-finance
personal loan without documents,https://www.bajajfinserv.in/personal-loan-without-documents
5 insurance terms every millennial should know,https://www.bajajfinserv.in/insights/5-insurance-terms-every-millennial-should-know
trekking travel insurance policy,https://www.bajajfinserv.in/trekking-travel-insurance-policy
extended warranty faq,https://www.bajajfinserv.in/insights/extended-warranty-faq
plan a trip to disneyland paris under 5 lakh,https://www.bajajfinserv.in/insights/plan-a-trip-to-disneyland-paris-under-5-lakh
emi network haier air conditioners,https://www.bajajfinserv.in/emi-network-haier-air-conditioners
what is minimum salary required for credit card,https://www.bajajfinserv.in/what-is-minimum-salary-required-for-credit-card
5 reasons why credit cards are better than debit cards,https://www.bajajfinserv.in/insights/5-reasons-why-credit-cards-are-better-than-debit-cards
types of business loans,https://www.bajajfinserv.in/videos/types-of-business-loans
rbl bank platinum choice supercard,https://www.bajajfinserv.in/rbl-bank-platinum-choice-supercard
check pre approved emi card offer,https://www.bajajfinserv.in/check-pre-approved-emi-card-offer
what is fuel credit card,https://www.bajajfinserv.in/what-is-fuel-credit-card
difference between demat account and trading account,https://www.bajajfinserv.in/insights/difference-between-demat-account-and-trading-account
loan against shares reviews,https://www.bajajfinserv.in/loan-against-shares-reviews
what is demat account,https://www.bajajfinserv.in/insights/what-is-demat-account
insurance,https://www.bajajfinserv.in/insurance
how to get instant paperless personal loan online,https://www.bajajfinserv.in/how-to-get-instant-paperless-personal-loan-online
emi network myg,https://www.bajajfinserv.in/emi-network-myg
remi store locator,https://www.bajajfinserv.in/remi-store-locator
clear your debts on time to maintain a good cibil score,https://www.bajajfinserv.in/insights/clear-your-debts-on-time-to-maintain-a-good-cibil-score
start up business loans,https://www.bajajfinserv.in/start-up-business-loans
personal loan for doctors,https://www.bajajfinserv.in/personal-loan-for-doctors
hospital cash cover,https://www.bajajfinserv.in/hospital-cash-cover
how personal loan part payment work,https://www.bajajfinserv.in/how-personal-loan-part-payment-work
fixed deposit eligibility and documents,https://www.bajajfinserv.in/fixed-deposit-eligibility-and-documents
personal loan what is the partprepayment of a loan,https://www.bajajfinserv.in/personal-loan-what-is-the-partprepayment-of-a-loan
check pre approved home loan offer,https://www.bajajfinserv.in/check-pre-approved-home-loan-offer
emi network led and lcd tv on emi,https://www.bajajfinserv.in/emi-network-led-and-lcd-tv-on-emi
should you lease or buy equipment for manufacturing business,https://www.bajajfinserv.in/insights/should-you-lease-or-buy-equipment-for-manufacturing-business
