Word,URL
rbl credit card interest rates,https://www.bajajfinserv.in/rbl-credit-card-interest-rates
refrigerator on emi,https://www.bajajfinserv.in/videos/refrigerator-on-emi
vhealth card,https://www.bajajfinserv.in/vhealth-card
how to choose the right credit card for yourself,https://www.bajajfinserv.in/insights/how-to-choose-the-right-credit-card-for-yourself
working capital,https://www.bajajfinserv.in/insights/working-capital
life insurance,https://www.bajajfinserv.in/life-insurance
apply for doctor loan,https://www.bajajfinserv.in/apply-for-doctor-loan
finance,https://www.bajajfinserv.in/finance
open extended warranty coverage,https://www.bajajfinserv.in/open-extended-warranty-coverage
why bajaj finance fixed deposit is the safest investment option,https://www.bajajfinserv.in/insights/why-bajaj-finance-fixed-deposit-is-the-safest-investment-option
fixed vs floating interest rate,https://www.bajajfinserv.in/fixed-vs-floating-interest-rate
flexi personal loan,https://www.bajajfinserv.in/flexi-personal-loan
become our partner,https://www.bajajfinserv.in/become-our-partner
instant personal loan,https://www.bajajfinserv.in/instant-personal-loan
how to upgrade credit card,https://www.bajajfinserv.in/insights/how-to-upgrade-credit-card
how the bajaj finserv rbl supercard gives you the power of 4 cards in 1,https://www.bajajfinserv.in/insights/how-the-bajaj-finserv-rbl-supercard-gives-you-the-power-of-4-cards-in-1
emi network eta o general air conditioners,https://www.bajajfinserv.in/emi-network-eta-o-general-air-conditioners
personal loan for travel fees and charges explained,https://www.bajajfinserv.in/insights/personal-loan-for-travel-fees-and-charges-explained
home loan,https://www.bajajfinserv.in/insights/home-loan
commonly asked questions around machinery loans,https://www.bajajfinserv.in/insights/commonly-asked-questions-around-machinery-loans
rbl credit card contact details,https://www.bajajfinserv.in/rbl-credit-card-contact-details
life insurance savings plans,https://www.bajajfinserv.in/life-insurance-savings-plans
how to combat high fuel prices with your credit card,https://www.bajajfinserv.in/insights/how-to-combat-high-fuel-prices-with-your-credit-card
what is credit card,https://www.bajajfinserv.in/what-is-credit-card
how to manage your international business travel expenses,https://www.bajajfinserv.in/insights/how-to-manage-your-international-business-travel-expenses
why is outstanding debt a bad omen for your credit score,https://www.bajajfinserv.in/insights/why-is-outstanding-debt-a-bad-omen-for-your-credit-score
inventory management techniques to save money,https://www.bajajfinserv.in/insights/inventory-management-techniques-to-save-money
emi network invertors on emi,https://www.bajajfinserv.in/emi-network-invertors-on-emi
personal loan what are foreclosure charges,https://www.bajajfinserv.in/personal-loan-what-are-foreclosure-charges
personal loan for wedding,https://www.bajajfinserv.in/personal-loan-for-wedding
shop on ecommerce,https://www.bajajfinserv.in/shop-on-ecommerce
third party car insurance,https://www.bajajfinserv.in/third-party-car-insurance
apply for credit card online,https://www.bajajfinserv.in/apply-for-credit-card-online
emi network lenovo laptops,https://www.bajajfinserv.in/emi-network-lenovo-laptops
check pre approved Credit card offer,https://www.bajajfinserv.in/check-pre-approved-Credit-card-offer
the different types of loans available in india,https://www.bajajfinserv.in/insights/the-different-types-of-loans-available-in-india
types of personal loan,https://www.bajajfinserv.in/videos/types-of-personal-loan
how is interest rate calculated on credit card,https://www.bajajfinserv.in/how-is-interest-rate-calculated-on-credit-card
difference between credit card and debit card,https://www.bajajfinserv.in/difference-between-credit-card-and-debit-card
pre approved pasa offers,https://www.bajajfinserv.in/pre-approved-pasa-offers
how you can use a credit card to improve your credit score,https://www.bajajfinserv.in/insights/how-you-can-use-a-credit-card-to-improve-your-credit-score
atm assault insurance cover pstp,https://www.bajajfinserv.in/atm-assault-insurance-cover-pstp
price protection insurance cover,https://www.bajajfinserv.in/price-protection-insurance-cover
4 ways to consolidate your debt,https://www.bajajfinserv.in/insights/4-ways-to-consolidate-your-debt
personal loan for debt consolidation,https://www.bajajfinserv.in/personal-loan-for-debt-consolidation
emi network godrej air conditioners,https://www.bajajfinserv.in/emi-network-godrej-air-conditioners
covid_19_moratorium_policy_may20.pdf,https://www.bajajfinserv.in/covid_19_moratorium_policy_may20.pdf
dengue fever symptoms causes preventions you need to know,https://www.bajajfinserv.in/insights/dengue-fever-symptoms-causes-preventions-you-need-to-know
what is bajaj insta emi card,https://www.bajajfinserv.in/insights/what-is-bajaj-insta-emi-card
how to go glamping across switzerland within 8 lakh,https://www.bajajfinserv.in/insights/how-to-go-glamping-across-switzerland-within-8-lakh
impact of gst on working capital for businesses,https://www.bajajfinserv.in/insights/impact-of-gst-on-working-capital-for-businesses
6 ways a personal loan can help you meet your financial needs,https://www.bajajfinserv.in/insights/6-ways-a-personal-loan-can-help-you-meet-your-financial-needs
life insurance protection plans,https://www.bajajfinserv.in/life-insurance-protection-plans
emi network refrigerators on emi,https://www.bajajfinserv.in/emi-network-refrigerators-on-emi
loan against securities application form,https://www.bajajfinserv.in/loan-against-securities-application-form
5 financial habits that will help you get a business loan,https://www.bajajfinserv.in/insights/5-financial-habits-that-will-help-you-get-a-business-loan
self employed credit card,https://www.bajajfinserv.in/insights/self-employed-credit-card
lease rental discounting reviews,https://www.bajajfinserv.in/lease-rental-discounting-reviews
two wheeler insurance,https://www.bajajfinserv.in/two-wheeler-insurance
what women entrepreneurs need to know about financing business,https://www.bajajfinserv.in/insights/what-women-entrepreneurs-need-to-know-about-financing-business
personal loan are there any foreclosure and part prepayment charges,https://www.bajajfinserv.in/personal-loan-are-there-any-foreclosure-and-part-prepayment-charges
personal loan for home renovation,https://www.bajajfinserv.in/videos/personal-loan-for-home-renovation
credit card login,https://www.bajajfinserv.in/credit-card-login
complete guide investing,https://www.bajajfinserv.in/complete-guide-investing
emi network multispeciality,https://www.bajajfinserv.in/emi-network-multispeciality
emi network emi card,https://www.bajajfinserv.in/emi-network-emi-card
can i pay my credit card bill in cash,https://www.bajajfinserv.in/can-i-pay-my-credit-card-bill-in-cash
education loan on property,https://www.bajajfinserv.in/education-loan-on-property
emi network emi card reviews,https://www.bajajfinserv.in/emi-network-emi-card-reviews
how to apply for loan against fixed deposit,https://www.bajajfinserv.in/how-to-apply-for-loan-against-fixed-deposit
loan against property eligibility and documents,https://www.bajajfinserv.in/loan-against-property-eligibility-and-documents
loan against fd application form.pdf,https://www.bajajfinserv.in/loan-against-fd-application-form.pdf
how to maintain a good business credit score the key to smooth business financing,https://www.bajajfinserv.in/insights/how-to-maintain-a-good-business-credit-score-the-key-to-smooth-business-financing
shop online vivo,https://www.bajajfinserv.in/shop-online-vivo
emi network happi mobiles,https://www.bajajfinserv.in/emi-network-happi-mobiles
how you can increase your chances of getting a personal loan,https://www.bajajfinserv.in/insights/how-you-can-increase-your-chances-of-getting-a-personal-loan
business loan emi calculator,https://www.bajajfinserv.in/business-loan-emi-calculator
how to convert credit card purchases into emis,https://www.bajajfinserv.in/how-to-convert-credit-card-purchases-into-emis
credit card against fd,https://www.bajajfinserv.in/insights/credit-card-against-fd
education loan on property calculator,https://www.bajajfinserv.in/education-loan-on-property-calculator
7 travel hacks that can save your time money and space,https://www.bajajfinserv.in/insights/7-travel-hacks-that-can-save-your-time-money-and-space
credit card bill payment,https://www.bajajfinserv.in/credit-card-bill-payment
how to change credit card mobile number,https://www.bajajfinserv.in/insights/how-to-change-credit-card-mobile-number
life insurance child plan application form,https://www.bajajfinserv.in/life-insurance-child-plan-application-form
how to open demat account,https://www.bajajfinserv.in/insights/how-to-open-demat-account
business loan,https://www.bajajfinserv.in/videos/business-loan
home loan form,https://www.bajajfinserv.in/home-loan-form
great cost saving tips for small businesses,https://www.bajajfinserv.in/insights/great-cost-saving-tips-for-small-businesses
disclosures page,https://www.bajajfinserv.in/disclosures-page
check pre approved loan offers,https://www.bajajfinserv.in/check-pre-approved-loan-offers
Business Loan EMI Calculator,https://www.bajajfinserv.in/Business-Loan-EMI-Calculator
how to check cibil score for personal loan,https://www.bajajfinserv.in/how-to-check-cibil-score-for-personal-loan
redmi phones under 10000,https://www.bajajfinserv.in/insights/redmi-phones-under-10000
check pre approved car loan balance transfer offer,https://www.bajajfinserv.in/check-pre-approved-car-loan-balance-transfer-offer
emi network home town,https://www.bajajfinserv.in/emi-network-home-town
emi network maternity care on emi,https://www.bajajfinserv.in/emi-network-maternity-care-on-emi
home loan vs loan against property,https://www.bajajfinserv.in/insights/home-loan-vs-loan-against-property
rbl bank freedom supercard,https://www.bajajfinserv.in/rbl-bank-freedom-supercard
a step by step guide to applying for a bajaj finserv personal loan,https://www.bajajfinserv.in/insights/a-step-by-step-guide-to-applying-for-a-bajaj-finserv-personal-loan
emi network room heater,https://www.bajajfinserv.in/emi-network-room-heater
credit card application tracking,https://www.bajajfinserv.in/credit-card-application-tracking
how to pay credit card bill through net banking,https://www.bajajfinserv.in/how-to-pay-credit-card-bill-through-net-banking
window ac vs split ac,https://www.bajajfinserv.in/insights/window-ac-vs-split-ac
how do lenders decide personal loan eligibility,https://www.bajajfinserv.in/how-do-lenders-decide-personal-loan-eligibility
credit card charges,https://www.bajajfinserv.in/credit-card-charges
how to get personal loan without bank statement,https://www.bajajfinserv.in/how-to-get-personal-loan-without-bank-statement
rbl bank value plus supercard,https://www.bajajfinserv.in/rbl-bank-value-plus-supercard
Lockdown_Locations.pdf,https://www.bajajfinserv.in/Lockdown_Locations.pdf
personal_loan_terms_and_conditions.pdf,https://www.bajajfinserv.in/personal_loan_terms_and_conditions.pdf
business loan fees and interest rates,https://www.bajajfinserv.in/business-loan-fees-and-interest-rates
emi network narayana nethralaya,https://www.bajajfinserv.in/emi-network-narayana-nethralaya
fixed deposit/post office fixed deposit,https://www.bajajfinserv.in/fixed-deposit/post-office-fixed-deposit
emi network ruby hall clinic,https://www.bajajfinserv.in/emi-network-ruby-hall-clinic
share trading,https://www.bajajfinserv.in/insights/share-trading
how to use working capital loans to strengthen your business,https://www.bajajfinserv.in/insights/how-to-use-working-capital-loans-to-strengthen-your-business
just emi,https://www.bajajfinserv.in/videos/just-emi
emi network emi card how to apply,https://www.bajajfinserv.in/emi-network-emi-card-how-to-apply
fixed deposit application form,https://www.bajajfinserv.in/videos/fixed-deposit-application-form
emi network eye care on emi,https://www.bajajfinserv.in/emi-network-eye-care-on-emi
what is the rate of interest for a personal loan from bajaj finserv,https://www.bajajfinserv.in/what-is-the-rate-of-interest-for-a-personal-loan-from-bajaj-finserv
credit rating types importance,https://www.bajajfinserv.in/insights/credit-rating-types-importance
rbl bank platinum advantage supercard,https://www.bajajfinserv.in/rbl-bank-platinum-advantage-supercard
top up loan,https://www.bajajfinserv.in/top-up-loan
7 international holiday destinations under rs.8 lakh,https://www.bajajfinserv.in/insights/7-international-holiday-destinations-under-rs.8-lakh
difference between tan pan tin,https://www.bajajfinserv.in/insights/difference-between-tan-pan-tin
lessons on business loans to learn from successful smes,https://www.bajajfinserv.in/insights/lessons-on-business-loans-to-learn-from-successful-smes
working capital loan,https://www.bajajfinserv.in/working-capital-loan
benefits of using internationall credit card,https://www.bajajfinserv.in/insights/benefits-of-using-internationall-credit-card
difference between simple and compound interest,https://www.bajajfinserv.in/insights/difference-between-simple-and-compound-interest
loan against fixed deposit,https://www.bajajfinserv.in/loan-against-fixed-deposit
gold loan eligibility and documents,https://www.bajajfinserv.in/gold-loan-eligibility-and-documents
rbl credit card login,https://www.bajajfinserv.in/rbl-credit-card-login
the top 5 reasons companies apply for a business loan,https://www.bajajfinserv.in/insights/the-top-5-reasons-companies-apply-for-a-business-loan
4 things you did not know a supercard can do for you,https://www.bajajfinserv.in/insights/4-things-you-did-not-know-a-supercard-can-do-for-you
sites/bajaj/pstp/images/HDFCLife_Click_2_Protect_3D_Plus_TermPlan.pdf,https://www.bajajfinserv.in/sites/bajaj/pstp/images/HDFCLife_Click_2_Protect_3D_Plus_TermPlan.pdf
4 financial habits to better manage business growth,https://www.bajajfinserv.in/insights/4-financial-habits-to-better-manage-business-growth
what is cibil and what does it have to do with your credit score,https://www.bajajfinserv.in/insights/what-is-cibil-and-what-does-it-have-to-do-with-your-credit-score
how to apply for a credit card,https://www.bajajfinserv.in/how-to-apply-for-a-credit-card
credit card form,https://www.bajajfinserv.in/credit-card-form
what makes your credit score an important piece of your loan process,https://www.bajajfinserv.in/insights/what-makes-your-credit-score-an-important-piece-of-your-loan-process
international summer vacations you can plan under rs5 lakh,https://www.bajajfinserv.in/insights/international-summer-vacations-you-can-plan-under-rs5-lakh
sme msme loan,https://www.bajajfinserv.in/sme-msme-loan
handbag assure,https://www.bajajfinserv.in/handbag-assure
Information_Security_Measures.pdf,https://www.bajajfinserv.in/Information_Security_Measures.pdf
why frequent flyers should pick a flexi interest only loan,https://www.bajajfinserv.in/insights/why-frequent-flyers-should-pick-a-flexi-interest-only-loan
ekyc online,https://www.bajajfinserv.in/insights/ekyc-online
emi network hp laptop,https://www.bajajfinserv.in/emi-network-hp-laptop
mutual funds eligibility and documents,https://www.bajajfinserv.in/mutual-funds-eligibility-and-documents
business loan for doctors,https://www.bajajfinserv.in/business-loan-for-doctors
business loan for chartered accountants,https://www.bajajfinserv.in/business-loan-for-chartered-accountants
pocket insurance,https://www.bajajfinserv.in/videos/pocket-insurance
how to add credit card to samsung pay,https://www.bajajfinserv.in/how-to-add-credit-card-to-samsung-pay
how to use your business loan in mumbai to finance growth,https://www.bajajfinserv.in/insights/how-to-use-your-business-loan-in-mumbai-to-finance-growth
how does virtual credit cards works,https://www.bajajfinserv.in/insights/how-does-virtual-credit-cards-works
pre approved loan offers,https://www.bajajfinserv.in/pre-approved-loan-offers
questions your business loan lender may ask when you take a small business loan,https://www.bajajfinserv.in/insights/questions-your-business-loan-lender-may-ask-when-you-take-a-small-business-loan
4 easy ways to finance your growing business,https://www.bajajfinserv.in/insights/4-easy-ways-to-finance-your-growing-business
fit for life fest,https://www.bajajfinserv.in/fit-for-life-fest
doctor loan,https://www.bajajfinserv.in/doctor-loan
what is personal loan,https://www.bajajfinserv.in/what-is-personal-loan
bajaj finserv experia app,https://www.bajajfinserv.in/bajaj-finserv-experia-app
where to check your cibil score,https://www.bajajfinserv.in/insights/where-to-check-your-cibil-score
emi network bmi calculator,https://www.bajajfinserv.in/emi-network-bmi-calculator
child personal accident cover pstp,https://www.bajajfinserv.in/child-personal-accident-cover-pstp
loan against property doctors,https://www.bajajfinserv.in/loan-against-property-doctors
5 mistakes to avoid while applying for a personal loan,https://www.bajajfinserv.in/insights/5-mistakes-to-avoid-while-applying-for-a-personal-loan
credit card bill generation date,https://www.bajajfinserv.in/credit-card-bill-generation-date
reasons why you should avail a personal loan,https://www.bajajfinserv.in/reasons-why-you-should-avail-a-personal-loan
what are the types of personal loans,https://www.bajajfinserv.in/what-are-the-types-of-personal-loans
msme full form,https://www.bajajfinserv.in/msme-full-form
travel insurance,https://www.bajajfinserv.in/travel-insurance
shop on ecommerce amazon,https://www.bajajfinserv.in/shop-on-ecommerce-amazon
key financing options for hotel and boutique owners,https://www.bajajfinserv.in/insights/key-financing-options-for-hotel-and-boutique-owners
emi network asus laptops,https://www.bajajfinserv.in/emi-network-asus-laptops
domestic travel insurance application form,https://www.bajajfinserv.in/domestic-travel-insurance-application-form
how to use a credit card wisely,https://www.bajajfinserv.in/insights/how-to-use-a-credit-card-wisely
corporate bajaj finserv,https://www.bajajfinserv.in/corporate-bajaj-finserv
credit card,https://www.bajajfinserv.in/credit-card
credit card billing cycle,https://www.bajajfinserv.in/credit-card-billing-cycle
chartered accountant loan,https://www.bajajfinserv.in/chartered-accountant-loan
how to reduce your credit card interest and save money,https://www.bajajfinserv.in/insights/how-to-reduce-your-credit-card-interest-and-save-money
tips on how to make the perfect business loan pitch,https://www.bajajfinserv.in/insights/tips-on-how-to-make-the-perfect-business-loan-pitch
can you get personal loan with low credit score below 750,https://www.bajajfinserv.in/can-you-get-personal-loan-with-low-credit-score-below-750
investments,https://www.bajajfinserv.in/investments
car insurance,https://www.bajajfinserv.in/car-insurance
fixed deposit faq,https://www.bajajfinserv.in/fixed-deposit-faq
documents you need to apply for a debt consolidation loan,https://www.bajajfinserv.in/insights/documents-you-need-to-apply-for-a-debt-consolidation-loan
health insurance application form,https://www.bajajfinserv.in/health-insurance-application-form
future group co branded emi network,https://www.bajajfinserv.in/future-group-co-branded-emi-network
emi network supreme mobiles,https://www.bajajfinserv.in/emi-network-supreme-mobiles
personal loan for self employed,https://www.bajajfinserv.in/personal-loan-for-self-employed
fixed deposit for women,https://www.bajajfinserv.in/fixed-deposit-for-women
impact of gst on personal loan,https://www.bajajfinserv.in/impact-of-gst-on-personal-loan
ideal credit scores to have when applying for loans,https://www.bajajfinserv.in/insights/ideal-credit-scores-to-have-when-applying-for-loans
tips to expand your manufacturing business,https://www.bajajfinserv.in/insights/tips-to-expand-your-manufacturing-business
finance home page,https://www.bajajfinserv.in/finance-home-page
emi network bluestar air conditioners,https://www.bajajfinserv.in/emi-network-bluestar-air-conditioners
what are the documents required for personal loan,https://www.bajajfinserv.in/what-are-the-documents-required-for-personal-loan
how to get personal loan without pan card,https://www.bajajfinserv.in/how-to-get-personal-loan-without-pan-card
emi network ss communication,https://www.bajajfinserv.in/emi-network-ss-communication
life saving plans application form,https://www.bajajfinserv.in/life-saving-plans-application-form
fastag,https://www.bajajfinserv.in/insights/fastag
how to open trading account,https://www.bajajfinserv.in/insights/how-to-open-trading-account
what are personal loan benefits,https://www.bajajfinserv.in/what-are-personal-loan-benefits
6 tips to grow your e commerce business,https://www.bajajfinserv.in/insights/6-tips-to-grow-your-e-commerce-business
shop on ecommerce makemytrip,https://www.bajajfinserv.in/shop-on-ecommerce-makemytrip
check cibil score by pan card number,https://www.bajajfinserv.in/insights/check-cibil-score-by-pan-card-number
car loan balance transfer and top up faqs,https://www.bajajfinserv.in/car-loan-balance-transfer-and-top-up-faqs
open demat trading account online,https://www.bajajfinserv.in/open-demat-trading-account-online
marketplace/pocketInsurance/,https://www.bajajfinserv.in/marketplace/pocketInsurance/
what is loan account number,https://www.bajajfinserv.in/insights/what-is-loan-account-number
shop online goibibo,https://www.bajajfinserv.in/shop-online-goibibo
check pre approved doctors loan offer,https://www.bajajfinserv.in/check-pre-approved-doctors-loan-offer
all about pf provident funds,https://www.bajajfinserv.in/all-about-pf-provident-funds
phishing,https://www.bajajfinserv.in/phishing
enrollment for collection partner,https://www.bajajfinserv.in/enrollment-for-collection-partner
rules for first credit card,https://www.bajajfinserv.in/insights/rules-for-first-credit-card
emi network hearing aid on emis,https://www.bajajfinserv.in/emi-network-hearing-aid-on-emis
gold loan reviews,https://www.bajajfinserv.in/gold-loan-reviews
what do i need to do to apply for a personal loan to travel,https://www.bajajfinserv.in/insights/what-do-i-need-to-do-to-apply-for-a-personal-loan-to-travel
everything you need to know about your credit score,https://www.bajajfinserv.in/insights/everything-you-need-to-know-about-your-credit-score
emi network health emi card,https://www.bajajfinserv.in/emi-network-health-emi-card
emi network haier washing machines,https://www.bajajfinserv.in/emi-network-haier-washing-machines
how to make contactless credit card payment,https://www.bajajfinserv.in/insights/how-to-make-contactless-credit-card-payment
6 reasons why your credit card application can be rejected,https://www.bajajfinserv.in/insights/6-reasons-why-your-credit-card-application-can-be-rejected
the 4 types of business loans explained,https://www.bajajfinserv.in/insights/the-4-types-of-business-loans-explained
home loan for doctors,https://www.bajajfinserv.in/home-loan-for-doctors
personal loan,https://www.bajajfinserv.in/insights/personal-loan
emi network oasis fertility,https://www.bajajfinserv.in/emi-network-oasis-fertility
thrifty tips to backpack across europe under 5 lakh,https://www.bajajfinserv.in/insights/thrifty-tips-to-backpack-across-europe-under-5-lakh
growth factors of nbfcs,https://www.bajajfinserv.in/insights/growth-factors-of-nbfcs
mobile screen insurance,https://www.bajajfinserv.in/mobile-screen-insurance
best ac under 30000,https://www.bajajfinserv.in/insights/best-ac-under-30000
how to get a personal loan,https://www.bajajfinserv.in/how-to-get-a-personal-loan
the life cycle of working capital explained,https://www.bajajfinserv.in/insights/the-life-cycle-of-working-capital-explained
personal loan pure flexi emi calculator,https://www.bajajfinserv.in/personal-loan-pure-flexi-emi-calculator
how to create a growth plan for your small business,https://www.bajajfinserv.in/insights/how-to-create-a-growth-plan-for-your-small-business
ways to revamp your bedroom decor under 20 lakh,https://www.bajajfinserv.in/insights/ways-to-revamp-your-bedroom-decor-under-20-lakh
fixed deposit,https://www.bajajfinserv.in/videos/fixed-deposit
sites/bajaj/pstp/images/BALIC eTouch.pdf,https://www.bajajfinserv.in/sites/bajaj/pstp/images/BALIC-eTouch.pdf
emi network onida ac,https://www.bajajfinserv.in/emi-network-onida-ac
lease rental discounting,https://www.bajajfinserv.in/lease-rental-discounting
tnc_Terms_and_Conditions.pdf,https://www.bajajfinserv.in/tnc_Terms_and_Conditions.pdf
how to get small personal loans,https://www.bajajfinserv.in/how-to-get-small-personal-loans
watch insurance cover,https://www.bajajfinserv.in/watch-insurance-cover
emi network cycles on emi,https://www.bajajfinserv.in/emi-network-cycles-on-emi
reach us,https://www.bajajfinserv.in/reach-us
emi network laptop on emi,https://www.bajajfinserv.in/emi-network-laptop-on-emi
emi network whirlpool air conditioners,https://www.bajajfinserv.in/emi-network-whirlpool-air-conditioners
two wheeler insurance frequently asked questions,https://www.bajajfinserv.in/two-wheeler-insurance-frequently-asked-questions
emi network tecno mobiles,https://www.bajajfinserv.in/emi-network-tecno-mobiles
finance a great education abroad with a personal loan,https://www.bajajfinserv.in/insights/finance-a-great-education-abroad-with-a-personal-loan
motor insurance,https://www.bajajfinserv.in/motor-insurance
loan against property reviews,https://www.bajajfinserv.in/loan-against-property-reviews
the best way to take a loan against your fixed deposit,https://www.bajajfinserv.in/insights/the-best-way-to-take-a-loan-against-your-fixed-deposit
how to get personal loan without income proof,https://www.bajajfinserv.in/how-to-get-personal-loan-without-income-proof
how to find the right personal loan for you,https://www.bajajfinserv.in/insights/how-to-find-the-right-personal-loan-for-you
