Word,URL
how has gst impacted the manufacturing sector,https://www.bajajfinserv.in/insights/how-has-gst-impacted-the-manufacturing-sector
how bajaj finserv working capital loans keep your business afloat,https://www.bajajfinserv.in/insights/how-bajaj-finserv-working-capital-loans-keep-your-business-afloat
a handy guide to reading your credit report correctly,https://www.bajajfinserv.in/insights/a-handy-guide-to-reading-your-credit-report-correctly
how to choose the right credit card,https://www.bajajfinserv.in/how-to-choose-the-right-credit-card
business areas that will boom,https://www.bajajfinserv.in/insights/business-areas-that-will-boom
rules for first credit card,https://www.bajajfinserv.in/insights/rules-for-first-credit-card
what is corporate card,https://www.bajajfinserv.in/insights/what-is-corporate-card
what makes a personal loan ideal for young professionals,https://www.bajajfinserv.in/insights/what-makes-a-personal-loan-ideal-for-young-professionals
check pre approved hdfc_pasa offers,https://www.bajajfinserv.in/check-pre-approved-hdfc_pasa-offers
how is interest calculated on personal loan,https://www.bajajfinserv.in/how-is-interest-calculated-on-personal-loan
flexi personal loan,https://www.bajajfinserv.in/videos/flexi-personal-loan
fixed deposit nri application form,https://www.bajajfinserv.in/fixed-deposit-nri-application-form
personal loan,https://www.bajajfinserv.in/videos/personal-loan
emi network home painting services on emi,https://www.bajajfinserv.in/emi-network-home-painting-services-on-emi
bajaj finserv wallet contact us,https://www.bajajfinserv.in/bajaj-finserv-wallet-contact-us
indemnity insurance for doctors application form,https://www.bajajfinserv.in/indemnity-insurance-for-doctors-application-form
how a flexi loan is the ideal way to meet your working capital needs,https://www.bajajfinserv.in/insights/how-a-flexi-loan-is-the-ideal-way-to-meet-your-working-capital-needs
emi network womens apparel on emi,https://www.bajajfinserv.in/emi-network-womens-apparel-on-emi
emi network oppo mobile phones,https://www.bajajfinserv.in/emi-network-oppo-mobile-phones
emi network emi without credit card,https://www.bajajfinserv.in/emi-network-emi-without-credit-card
4 reasons for personal loan rejection and how to avoid them,https://www.bajajfinserv.in/insights/4-reasons-for-personal-loan-rejection-and-how-to-avoid-them
world homeopathy day 10th april,https://www.bajajfinserv.in/world-homeopathy-day-10th-april
how to apply online for bajaj insta emi card,https://www.bajajfinserv.in/insights/how-to-apply-online-for-bajaj-insta-emi-card
rbl credit card reward login,https://www.bajajfinserv.in/rbl-credit-card-reward-login
the msme loan the efficient financing solution for msmes,https://www.bajajfinserv.in/insights/the-msme-loan-the-efficient-financing-solution-for-msmes
how working capital can make or break your small business,https://www.bajajfinserv.in/insights/how-working-capital-can-make-or-break-your-small-business
personal loan flexi day wise interest calculator,https://www.bajajfinserv.in/personal-loan-flexi-day-wise-interest-calculator
emi store,https://www.bajajfinserv.in/emi-store
how to calculate foreclosure of a loan,https://www.bajajfinserv.in/how-to-calculate-foreclosure-of-a-loan
how to cancel credit card,https://www.bajajfinserv.in/how-to-cancel-credit-card
how is your cibil score calculated,https://www.bajajfinserv.in/insights/how-is-your-cibil-score-calculated
government business loan schemes in india all you need to know,https://www.bajajfinserv.in/insights/government-business-loan-schemes-in-india-all-you-need-to-know
rbl bank world plus supercard,https://www.bajajfinserv.in/rbl-bank-world-plus-supercard
best selling phones in india,https://www.bajajfinserv.in/insights/best-selling-phones-in-india
pocket insurance,https://www.bajajfinserv.in/insights/pocket-insurance
emi network water purifiers on emi,https://www.bajajfinserv.in/emi-network-water-purifiers-on-emi
gst calculator,https://www.bajajfinserv.in/gst-calculator
how to use a credit card,https://www.bajajfinserv.in/how-to-use-a-credit-card
insurance,https://www.bajajfinserv.in/insights/insurance
why should you use a bajaj finserv personal loan to finance your next vacation,https://www.bajajfinserv.in/insights/why-should-you-use-a-bajaj-finserv-personal-loan-to-finance-your-next-vacation
emi network holiday packages on emi,https://www.bajajfinserv.in/emi-network-holiday-packages-on-emi
5 important things to know before taking a personal loan,https://www.bajajfinserv.in/insights/5-important-things-to-know-before-taking-a-personal-loan
dos and donts of taking a personal loan,https://www.bajajfinserv.in/dos-and-donts-of-taking-a-personal-loan
difference between regular business loans and microloans,https://www.bajajfinserv.in/insights/difference-between-regular-business-loans-and-microloans
loan against shares faq questions,https://www.bajajfinserv.in/loan-against-shares-faq-questions
fixed deposit for senior citizen,https://www.bajajfinserv.in/fixed-deposit-for-senior-citizen
gratuity calculator,https://www.bajajfinserv.in/gratuity-calculator
what makes the bajaj finserv flexi personal loan your ideal finance buddy for travel,https://www.bajajfinserv.in/insights/what-makes-the-bajaj-finserv-flexi-personal-loan-your-ideal-finance-buddy-for-travel
great sources of financing for women business persons,https://www.bajajfinserv.in/insights/great-sources-of-financing-for-women-business-persons
shop online d2h,https://www.bajajfinserv.in/shop-online-d2h
home loan emi calculator,https://www.bajajfinserv.in/home-loan-emi-calculator
personal loan difference between secured and unsecured loans,https://www.bajajfinserv.in/personal-loan-difference-between-secured-and-unsecured-loans
rbl bank shop smart supercard,https://www.bajajfinserv.in/rbl-bank-shop-smart-supercard
bank or nbfc why getting personal loan from nbfc is better,https://www.bajajfinserv.in/bank-or-nbfc-why-getting-personal-loan-from-nbfc-is-better
emi network at home,https://www.bajajfinserv.in/emi-network-at-home
emi network washing machines on emi,https://www.bajajfinserv.in/emi-network-washing-machines-on-emi
bajaj finserv a one stop destination for all your personal loan queries,https://www.bajajfinserv.in/insights/bajaj-finserv-a-one-stop-destination-for-all-your-personal-loan-queries
how a personal loan can help you study abroad,https://www.bajajfinserv.in/insights/how-a-personal-loan-can-help-you-study-abroad
health rx,https://www.bajajfinserv.in/health-rx
insta emi network card apply online,https://www.bajajfinserv.in/insta-emi-network-card-apply-online
shop online amazon,https://www.bajajfinserv.in/shop-online-amazon
cyber security cover,https://www.bajajfinserv.in/cyber-security-cover
5 percent cashback on downpayment,https://www.bajajfinserv.in/5-percent-cashback-on-downpayment
insta credit on emi card,https://www.bajajfinserv.in/insta-credit-on-emi-card
rental deposit loan application form,https://www.bajajfinserv.in/rental-deposit-loan-application-form
when is it a good idea to avail a personal loan,https://www.bajajfinserv.in/insights/when-is-it-a-good-idea-to-avail-a-personal-loan
personal loan for travel,https://www.bajajfinserv.in/personal-loan-for-travel
personal loan for higher education,https://www.bajajfinserv.in/personal-loan-for-higher-education
what are the types of working capital policies,https://www.bajajfinserv.in/insights/what-are-the-types-of-working-capital-policies
check free cibil score,https://www.bajajfinserv.in/check-free-cibil-score
emi network richfeel,https://www.bajajfinserv.in/emi-network-richfeel
convert term loan to flexi loan,https://www.bajajfinserv.in/convert-term-loan-to-flexi-loan
offbeat destinations under 5 lakh for solo women travelers,https://www.bajajfinserv.in/insights/offbeat-destinations-under-5-lakh-for-solo-women-travelers
how much personal loan can i get on my salary,https://www.bajajfinserv.in/insights/how-much-personal-loan-can-i-get-on-my-salary
car loan balance transfer application form,https://www.bajajfinserv.in/car-loan-balance-transfer-application-form
dengue insurance policy,https://www.bajajfinserv.in/dengue-insurance-policy
emi network emi card faq,https://www.bajajfinserv.in/emi-network-emi-card-faq
rediscover the lost city of inca under 5 lakh,https://www.bajajfinserv.in/insights/rediscover-the-lost-city-of-inca-under-5-lakh
how does outstanding debt affect your credit score,https://www.bajajfinserv.in/insights/how-does-outstanding-debt-affect-your-credit-score
life insurance retirement pension plans,https://www.bajajfinserv.in/insights/life-insurance-retirement-pension-plans
mobile search,https://www.bajajfinserv.in/mobile-search
how rental deposit loans are making it easy for you to rent a new house,https://www.bajajfinserv.in/insights/how-rental-deposit-loans-are-making-it-easy-for-you-to-rent-a-new-house
personal loan vs credit card calculator,https://www.bajajfinserv.in/personal-loan-vs-credit-card-calculator
what is loan against credit card,https://www.bajajfinserv.in/what-is-loan-against-credit-card
purchase protection insurance cover pstp,https://www.bajajfinserv.in/purchase-protection-insurance-cover-pstp
cibil report correction,https://www.bajajfinserv.in/insights/cibil-report-correction
compare credit cards,https://www.bajajfinserv.in/compare-credit-cards
emi network tablets on emi,https://www.bajajfinserv.in/emi-network-tablets-on-emi
emi network refrigerator on emi,https://www.bajajfinserv.in/emi-network-refrigerator-on-emi
credit card,https://www.bajajfinserv.in/insights/credit-card
home loan application form,https://www.bajajfinserv.in/home-loan-application-form
8 reasons your business loan was rejected,https://www.bajajfinserv.in/insights/8-reasons-your-business-loan-was-rejected
domestic travel insurance policy plans,https://www.bajajfinserv.in/domestic-travel-insurance-policy-plans
forms centre,https://www.bajajfinserv.in/forms-centre
pan card,https://www.bajajfinserv.in/pan-card
personal loan agreements terms and conditions,https://www.bajajfinserv.in/personal-loan-agreements-terms-and-conditions
personal loan for chartered accountants,https://www.bajajfinserv.in/personal-loan-for-chartered-accountants
home loan for chartered accountants,https://www.bajajfinserv.in/home-loan-for-chartered-accountants
fixed deposit calculators,https://www.bajajfinserv.in/fixed-deposit-calculators
rbl world prime supercard,https://www.bajajfinserv.in/rbl-world-prime-supercard
emi network diagnostic care on emis,https://www.bajajfinserv.in/emi-network-diagnostic-care-on-emis
personal loan what is interest rate for a personal loan,https://www.bajajfinserv.in/personal-loan-what-is-interest-rate-for-a-personal-loan
fixed deposit application form,https://www.bajajfinserv.in/fixed-deposit-application-form
points to consider before applying for personal loan,https://www.bajajfinserv.in/points-to-consider-before-applying-for-personal-loan
what is ekyc,https://www.bajajfinserv.in/insights/what-is-ekyc
gold loan fees and interest rates,https://www.bajajfinserv.in/gold-loan-fees-and-interest-rates
how do credit cards work,https://www.bajajfinserv.in/how-do-credit-cards-work
flat interest rate vs reducing interest rate,https://www.bajajfinserv.in/flat-interest-rate-vs-reducing-interest-rate
rbl bank,https://www.bajajfinserv.in/rbl-bank
rbl bank ca supercard,https://www.bajajfinserv.in/rbl-bank-ca-supercard
how to apply for fixed deposit,https://www.bajajfinserv.in/how-to-apply-for-fixed-deposit
home loan pradhan mantri awas yojana,https://www.bajajfinserv.in/home-loan-pradhan-mantri-awas-yojana
how to calculate your business working capital requirement,https://www.bajajfinserv.in/how-to-calculate-your-business-working-capital-requirement
two wheeler insurance add on covers,https://www.bajajfinserv.in/two-wheeler-insurance-add-on-covers
emi network home kitchen furniture,https://www.bajajfinserv.in/emi-network-home-kitchen-furniture
5 tips for digital business owners to become successful,https://www.bajajfinserv.in/insights/5-tips-for-digital-business-owners-to-become-successful
lost your wallet follow these 7 steps right now,https://www.bajajfinserv.in/insights/lost-your-wallet-follow-these-7-steps-right-now
emi network sony led tv,https://www.bajajfinserv.in/emi-network-sony-led-tv
emi network other items on emi,https://www.bajajfinserv.in/emi-network-other-items-on-emi
careers,https://www.bajajfinserv.in/careers
loan against property chartered accountants,https://www.bajajfinserv.in/loan-against-property-chartered-accountants
hybrid flexi personal loan emi calculator,https://www.bajajfinserv.in/hybrid-flexi-personal-loan-emi-calculator
moratorium_bfl.pdf,https://www.bajajfinserv.in/moratorium_bfl.pdf
Interest rate policy_Interest rate policy.pdf,https://www.bajajfinserv.in/Interest-rate-policy_Interest-rate-policy.pdf
how to change credit card mobile number,https://www.bajajfinserv.in/insights/how-to-change-credit-card-mobile-number
mudra loan,https://www.bajajfinserv.in/mudra-loan
personal loan emi calculator,https://www.bajajfinserv.in/personal-loan-emi-calculator
does your business credit report matter when applying for a business loan,https://www.bajajfinserv.in/insights/does-your-business-credit-report-matter-when-applying-for-a-business-loan
when is it a good idea to apply for personal loan,https://www.bajajfinserv.in/when-is-it-a-good-idea-to-apply-for-personal-loan
emi network health emi card post login,https://www.bajajfinserv.in/emi-network-health-emi-card-post-login
loan against car faqs,https://www.bajajfinserv.in/loan-against-car-faqs
check emi overdue,https://www.bajajfinserv.in/check-emi-overdue
personal trip liability insurance cover,https://www.bajajfinserv.in/personal-trip-liability-insurance-cover
how do you check your cibil score,https://www.bajajfinserv.in/how-do-you-check-your-cibil-score
what is minimum amount due in credit card,https://www.bajajfinserv.in/what-is-minimum-amount-due-in-credit-card
corporate bajaj finance,https://www.bajajfinserv.in/corporate-bajaj-finance
emi network suburban diagnostics,https://www.bajajfinserv.in/emi-network-suburban-diagnostics
how to choose the right machinery supplier,https://www.bajajfinserv.in/insights/how-to-choose-the-right-machinery-supplier
commonly asked questions around business loans,https://www.bajajfinserv.in/insights/commonly-asked-questions-around-business-loans
bajaj finserv wallet reviews,https://www.bajajfinserv.in/bajaj-finserv-wallet-reviews
emi network appliances on emi,https://www.bajajfinserv.in/emi-network-appliances-on-emi
loan against property application form,https://www.bajajfinserv.in/loan-against-property-application-form
home loan balance transfer calculator,https://www.bajajfinserv.in/home-loan-balance-transfer-calculator
difference between flexi business loans and term loans,https://www.bajajfinserv.in/insights/difference-between-flexi-business-loans-and-term-loans
emi network ac air conditioner,https://www.bajajfinserv.in/emi-network-ac-air-conditioner
shop online realme,https://www.bajajfinserv.in/shop-online-realme
shop online curefit,https://www.bajajfinserv.in/shop-online-curefit
life insurance investment plans,https://www.bajajfinserv.in/life-insurance-investment-plans
health emi network card,https://www.bajajfinserv.in/videos/health-emi-network-card
fixed deposit/sdp calculators,https://www.bajajfinserv.in/fixed-deposit/sdp-calculators
credit card,https://www.bajajfinserv.in/videos/credit-card
gold loan how to apply,https://www.bajajfinserv.in/gold-loan-how-to-apply
price protection insurance cover pstp,https://www.bajajfinserv.in/price-protection-insurance-cover-pstp
how to pay credit card bill through google pay,https://www.bajajfinserv.in/how-to-pay-credit-card-bill-through-google-pay
emi network zebrs,https://www.bajajfinserv.in/emi-network-zebrs
consolidate your debt with a personal loan from bajaj finserv,https://www.bajajfinserv.in/insights/consolidate-your-debt-with-a-personal-loan-from-bajaj-finserv
key replacement insurance cover,https://www.bajajfinserv.in/key-replacement-insurance-cover
personal loan eligibility calculator,https://www.bajajfinserv.in/personal-loan-eligibility-calculator
funding options to raise capital for your business,https://www.bajajfinserv.in/insights/funding-options-to-raise-capital-for-your-business
offers and promotions home,https://www.bajajfinserv.in/offers-and-promotions-home
all fees and charges,https://www.bajajfinserv.in/all-fees-and-charges
eyewear assure,https://www.bajajfinserv.in/eyewear-assure
firecracker insurance cover pstp,https://www.bajajfinserv.in/firecracker-insurance-cover-pstp
customer portal,https://www.bajajfinserv.in/customer-portal
shop online pepperfry,https://www.bajajfinserv.in/shop-online-pepperfry
pilgrimage holiday insurance application form,https://www.bajajfinserv.in/pilgrimage-holiday-insurance-application-form
how to pay credit card bill through paytm,https://www.bajajfinserv.in/how-to-pay-credit-card-bill-through-paytm
apply for a bajaj finserv personal loan in minutes,https://www.bajajfinserv.in/insights/apply-for-a-bajaj-finserv-personal-loan-in-minutes
rbl bank platinum shopgain supercard,https://www.bajajfinserv.in/rbl-bank-platinum-shopgain-supercard
5 simple tips to get the most out of your credit card,https://www.bajajfinserv.in/insights/5-simple-tips-to-get-the-most-out-of-your-credit-card
emi network libra mattress,https://www.bajajfinserv.in/emi-network-libra-mattress
Terms__and_conditions.pdf,https://www.bajajfinserv.in/Terms__and_conditions.pdf
how to check transunion cibil score,https://www.bajajfinserv.in/how-to-check-transunion-cibil-score
5 habits that can help you maintain a good credit score,https://www.bajajfinserv.in/insights/5-habits-that-can-help-you-maintain-a-good-credit-score
floating interest rates vs fixed interest rate what is a better option when you opt for a lap,https://www.bajajfinserv.in/insights/floating-interest-rates-vs-fixed-interest-rate-what-is-a-better-option-when-you-opt-for-a-lap
how to get credit card without income or salary,https://www.bajajfinserv.in/insights/how-to-get-credit-card-without-income-or-salary
7 essential personal loan charges you should keep in mind,https://www.bajajfinserv.in/insights/7-essential-personal-loan-charges-you-should-keep-in-mind
tips that help you save money when renovating your home,https://www.bajajfinserv.in/insights/tips-that-help-you-save-money-when-renovating-your-home
emi network card,https://www.bajajfinserv.in/videos/emi-network-card
kisan credit card,https://www.bajajfinserv.in/insights/kisan-credit-card
apr credit card,https://www.bajajfinserv.in/apr-credit-card
how working capital helps your business stay agile,https://www.bajajfinserv.in/insights/how-working-capital-helps-your-business-stay-agile
extended warranty,https://www.bajajfinserv.in/extended-warranty
loan against property emi calculator,https://www.bajajfinserv.in/loan-against-property-emi-calculator
pros and cons of business loan without collateral,https://www.bajajfinserv.in/insights/pros-and-cons-of-business-loan-without-collateral
9 reasons to take a loan for your wedding,https://www.bajajfinserv.in/insights/9-reasons-to-take-a-loan-for-your-wedding
why is bajaj finserv one of the most preferred personal loan lender in india,https://www.bajajfinserv.in/insights/why-is-bajaj-finserv-one-of-the-most-preferred-personal-loan-lender-in-india
emi network sports fitness travel,https://www.bajajfinserv.in/emi-network-sports-fitness-travel
how to get personal loan for students,https://www.bajajfinserv.in/how-to-get-personal-loan-for-students
rbl bank travel easy supercard,https://www.bajajfinserv.in/rbl-bank-travel-easy-supercard
how to manage your emi better with a personal loan for travel,https://www.bajajfinserv.in/insights/how-to-manage-your-emi-better-with-a-personal-loan-for-travel
what makes collateral free bajaj finserv engineer loans the best for your business,https://www.bajajfinserv.in/insights/what-makes-collateral-free-bajaj-finserv-engineer-loans-the-best-for-your-business
what is working capital,https://www.bajajfinserv.in/insights/what-is-working-capital
shop online make my trip,https://www.bajajfinserv.in/shop-online-make-my-trip
how a co borrower can increase the chance of getting your personal loan approved,https://www.bajajfinserv.in/insights/how-a-co-borrower-can-increase-the-chance-of-getting-your-personal-loan-approved
emi network health emi card eligibility,https://www.bajajfinserv.in/emi-network-health-emi-card-eligibility
shop online iqoo,https://www.bajajfinserv.in/shop-online-iqoo
personal loan for home improvement,https://www.bajajfinserv.in/personal-loan-for-home-improvement
3 types of loans against property you should know about,https://www.bajajfinserv.in/insights/3-types-of-loans-against-property-you-should-know-about
business ideas for women and arrange for funds,https://www.bajajfinserv.in/insights/business-ideas-for-women-and-arrange-for-funds
finance corporate ombudsman,https://www.bajajfinserv.in/finance-corporate-ombudsman
improve your cash flow by taking equipment loan,https://www.bajajfinserv.in/insights/improve-your-cash-flow-by-taking-equipment-loan
emi network whirlpool refrigerator,https://www.bajajfinserv.in/emi-network-whirlpool-refrigerator
is your cibil score getting you down,https://www.bajajfinserv.in/insights/is-your-cibil-score-getting-you-down
manufacturing business that are booming,https://www.bajajfinserv.in/insights/manufacturing-business-that-are-booming
e home loan,https://www.bajajfinserv.in/e-home-loan
how to improve credit card eligibility,https://www.bajajfinserv.in/how-to-improve-credit-card-eligibility
check pre approved credit card offer,https://www.bajajfinserv.in/check-pre-approved-credit-card-offer
personal loan eligibility and documents,https://www.bajajfinserv.in/personal-loan-eligibility-and-documents
shop online our partners,https://www.bajajfinserv.in/shop-online-our-partners
achieving smart growth a guide for manufacturers,https://www.bajajfinserv.in/insights/achieving-smart-growth-a-guide-for-manufacturers
this is how you can avail better interest rate for your personal loan,https://www.bajajfinserv.in/insights/this-is-how-you-can-avail-better-interest-rate-for-your-personal-loan
rbl credit card payment,https://www.bajajfinserv.in/rbl-credit-card-payment
home loan,https://www.bajajfinserv.in/home-loan
4 simple ways to manage your debt,https://www.bajajfinserv.in/insights/4-simple-ways-to-manage-your-debt
emi network vivo mobile phones,https://www.bajajfinserv.in/emi-network-vivo-mobile-phones
life insurance retirement pension plans,https://www.bajajfinserv.in/life-insurance-retirement-pension-plans
learn about secured credit cards and their features,https://www.bajajfinserv.in/insights/learn-about-secured-credit-cards-and-their-features
how to ensure your business never runs out of working capital,https://www.bajajfinserv.in/insights/how-to-ensure-your-business-never-runs-out-of-working-capital
personal loan contact details,https://www.bajajfinserv.in/personal-loan-contact-details
fixed deposit/apply for credit card,https://www.bajajfinserv.in/fixed-deposit/apply-for-credit-card
know how cibil score is important for personal lending,https://www.bajajfinserv.in/insights/know-how-cibil-score-is-important-for-personal-lending
how to repay your credit card debt,https://www.bajajfinserv.in/insights/how-to-repay-your-credit-card-debt
5 exclusive benefits of a supercard that other credit cards dont offer,https://www.bajajfinserv.in/insights/5-exclusive-benefits-of-a-supercard-that-other-credit-cards-dont-offer
life insurance retirement plan application form,https://www.bajajfinserv.in/life-insurance-retirement-plan-application-form
check pre approved loan against car offer,https://www.bajajfinserv.in/check-pre-approved-loan-against-car-offer
instant personal loan balance transfer,https://www.bajajfinserv.in/instant-personal-loan-balance-transfer
emi network emi card eligibility,https://www.bajajfinserv.in/emi-network-emi-card-eligibility
what makes a bajaj finserv flexi term loan the ideal tool to manage your travel expenses,https://www.bajajfinserv.in/insights/what-makes-a-bajaj-finserv-flexi-term-loan-the-ideal-tool-to-manage-your-travel-expenses
emi network electronics,https://www.bajajfinserv.in/emi-network-electronics
how to correct a late payment record on your credit report,https://www.bajajfinserv.in/insights/how-to-correct-a-late-payment-record-on-your-credit-report
emi network samsung tv,https://www.bajajfinserv.in/emi-network-samsung-tv
how to apply for a duplicate pan card,https://www.bajajfinserv.in/insights/how-to-apply-for-a-duplicate-pan-card
home insurances faq questions,https://www.bajajfinserv.in/home-insurances-faq-questions
what is cvv number,https://www.bajajfinserv.in/insights/what-is-cvv-number
personal loan verification process,https://www.bajajfinserv.in/personal-loan-verification-process
shop online oppo,https://www.bajajfinserv.in/shop-online-oppo
fixed deposit short lead form,https://www.bajajfinserv.in/fixed-deposit-short-lead-form
find the right personal loan tenor that works for you,https://www.bajajfinserv.in/insights/find-the-right-personal-loan-tenor-that-works-for-you
car loan balance transfer and top up,https://www.bajajfinserv.in/car-loan-balance-transfer-and-top-up
our online partners,https://www.bajajfinserv.in/our-online-partners
lease rental discounting faqs,https://www.bajajfinserv.in/lease-rental-discounting-faqs
emi network health emi card apply online,https://www.bajajfinserv.in/emi-network-health-emi-card-apply-online
instant personal loan application form,https://www.bajajfinserv.in/instant-personal-loan-application-form
offers and promotions,https://www.bajajfinserv.in/offers-and-promotions
foreclosure and part prepayment charges on personal loan,https://www.bajajfinserv.in/foreclosure-and-part-prepayment-charges-on-personal-loan
