Word,URL
lifecare services at apollo hospitals,https://www.bajajfinserv.in/lifecare-services-at-apollo-hospitals
how to apply for personal loan,https://www.bajajfinserv.in/how-to-apply-for-personal-loan
emi network laptops on emi,https://www.bajajfinserv.in/emi-network-laptops-on-emi
visit worlds most unique beaches under 7 lakh,https://www.bajajfinserv.in/insights/visit-worlds-most-unique-beaches-under-7-lakh
smart finance tips for business owners,https://www.bajajfinserv.in/videos/smart-finance-tips-for-business-owners
what is minimum cibil score for personal loan,https://www.bajajfinserv.in/what-is-minimum-cibil-score-for-personal-loan
life insurance application form,https://www.bajajfinserv.in/life-insurance-application-form
credit rating agencies india,https://www.bajajfinserv.in/insights/credit-rating-agencies-india
shop online mi,https://www.bajajfinserv.in/shop-online-mi
loan against property,https://www.bajajfinserv.in/loan-against-property
bonus reward on bfl cobrand credit card.pdf,https://www.bajajfinserv.in/bonus-reward-on-bfl-cobrand-credit-card.pdf
emi network,https://www.bajajfinserv.in/emi-network
credit card security what is cvv number and how to find it,https://www.bajajfinserv.in/insights/credit-card-security-what-is-cvv-number-and-how-to-find-it
emi network wellness services on emi,https://www.bajajfinserv.in/emi-network-wellness-services-on-emi
moratorium faq for personal loan,https://www.bajajfinserv.in/moratorium-faq-for-personal-loan
personal loan tips to improve your chances of approval,https://www.bajajfinserv.in/personal-loan-tips-to-improve-your-chances-of-approval
loan against fixed deposit faq questionss,https://www.bajajfinserv.in/loan-against-fixed-deposit-faq-questionss
shop on ecommerce flipkart,https://www.bajajfinserv.in/shop-on-ecommerce-flipkart
pre approved personal loan offer,https://www.bajajfinserv.in/pre-approved-personal-loan-offer
mumbai local train insurance pstp,https://www.bajajfinserv.in/mumbai-local-train-insurance-pstp
mutual funds,https://www.bajajfinserv.in/mutual-funds
bfl citizens charter.pdf,https://www.bajajfinserv.in/bfl-citizens-charter.pdf
how to track bajaj finserv personal loan application status,https://www.bajajfinserv.in/how-to-track-bajaj-finserv-personal-loan-application-status
safe investment options,https://www.bajajfinserv.in/videos/safe-investment-options
how to plan your home renovation in 3 quick steps,https://www.bajajfinserv.in/insights/how-to-plan-your-home-renovation-in-3-quick-steps
emi network elgiultra kitchen appliances,https://www.bajajfinserv.in/emi-network-elgiultra-kitchen-appliances
which is better personal loan or credit card loan,https://www.bajajfinserv.in/which-is-better-personal-loan-or-credit-card-loan
how to check your cibil score,https://www.bajajfinserv.in/insights/how-to-check-your-cibil-score
shop online seniority,https://www.bajajfinserv.in/shop-online-seniority
contact us faq queries,https://www.bajajfinserv.in/contact-us-faq-queries
how to check and improve credit card cibil score,https://www.bajajfinserv.in/how-to-check-and-improve-credit-card-cibil-score
business loan form,https://www.bajajfinserv.in/business-loan-form
rbl bank platinum shopdaily supercard,https://www.bajajfinserv.in/rbl-bank-platinum-shopdaily-supercard
5 mistakes to avoid when it comes to repaying your debt,https://www.bajajfinserv.in/insights/5-mistakes-to-avoid-when-it-comes-to-repaying-your-debt
5 reasons to apply for a personal loan from bajaj finserv,https://www.bajajfinserv.in/insights/5-reasons-to-apply-for-a-personal-loan-from-bajaj-finserv
sdp calculators,https://www.bajajfinserv.in/videos/sdp-calculators
your handy guide to personal loan faqs,https://www.bajajfinserv.in/insights/your-handy-guide-to-personal-loan-faqs
emi network google pixel,https://www.bajajfinserv.in/emi-network-google-pixel
two and three wheeler loan reviews,https://www.bajajfinserv.in/two-and-three-wheeler-loan-reviews
national common mobility card,https://www.bajajfinserv.in/insights/national-common-mobility-card
5 reasons why you should apply for a personal loan for debt consolidation,https://www.bajajfinserv.in/insights/5-reasons-why-you-should-apply-for-a-personal-loan-for-debt-consolidation
what is cash limit in credit card,https://www.bajajfinserv.in/what-is-cash-limit-in-credit-card
personal loan what is the duration of personal loan,https://www.bajajfinserv.in/personal-loan-what-is-the-duration-of-personal-loan
kisan credit card,https://www.bajajfinserv.in/insights/kisan-credit-card
pocket insurance plan,https://www.bajajfinserv.in/pocket-insurance-plan
choosing eyeglass frames 4 factors you must consider,https://www.bajajfinserv.in/insights/choosing-eyeglass-frames-4-factors-you-must-consider
aadhaar card all you wanted to know,https://www.bajajfinserv.in/insights/aadhaar-card-all-you-wanted-to-know
gold loan application form,https://www.bajajfinserv.in/gold-loan-application-form
emi network mobiles on emi,https://www.bajajfinserv.in/emi-network-mobiles-on-emi
financial fitness report,https://www.bajajfinserv.in/financial-fitness-report
emi network apollo hospitals,https://www.bajajfinserv.in/emi-network-apollo-hospitals
credit card offers,https://www.bajajfinserv.in/credit-card-offers
secured business loan form,https://www.bajajfinserv.in/secured-business-loan-form
rbl credit card,https://www.bajajfinserv.in/rbl-credit-card
personal loan foreclosure calculator,https://www.bajajfinserv.in/personal-loan-foreclosure-calculator
investment mutual funds mutual fund non individual how to apply,https://www.bajajfinserv.in/investment-mutual-funds-mutual-fund-non-individual-how-to-apply
how to make contactless credit card payment,https://www.bajajfinserv.in/insights/how-to-make-contactless-credit-card-payment
personal loan,https://www.bajajfinserv.in/personal-loan
emi network ao smith,https://www.bajajfinserv.in/emi-network-ao-smith
all you need to know about the supercard,https://www.bajajfinserv.in/insights/all-you-need-to-know-about-the-supercard
home insurance application form,https://www.bajajfinserv.in/home-insurance-application-form
smartphones on emi,https://www.bajajfinserv.in/videos/smartphones-on-emi
home decor and furniture,https://www.bajajfinserv.in/home-decor-and-furniture
what are advantages and disadvantages of credit card,https://www.bajajfinserv.in/what-are-advantages-and-disadvantages-of-credit-card
how a bajaj finserv flexi business loan can help your business grow,https://www.bajajfinserv.in/insights/how-a-bajaj-finserv-flexi-business-loan-can-help-your-business-grow
digital emi network card terms and conditions,https://www.bajajfinserv.in/digital-emi-network-card-terms-and-conditions
personal loan for medical emergency,https://www.bajajfinserv.in/personal-loan-for-medical-emergency
best ac under 25000,https://www.bajajfinserv.in/insights/best-ac-under-25000
how to redeem your credit card reward points,https://www.bajajfinserv.in/insights/how-to-redeem-your-credit-card-reward-points
emi network haier refrigerator,https://www.bajajfinserv.in/emi-network-haier-refrigerator
how to save cost with lean manufacturing,https://www.bajajfinserv.in/insights/how-to-save-cost-with-lean-manufacturing
6 ways to protect your credit card from being hacked,https://www.bajajfinserv.in/insights/6-ways-to-protect-your-credit-card-from-being-hacked
instant personal loan on aadhar card,https://www.bajajfinserv.in/instant-personal-loan-on-aadhar-card
9 things to know about travel loans in india,https://www.bajajfinserv.in/insights/9-things-to-know-about-travel-loans-in-india
asset care,https://www.bajajfinserv.in/asset-care
emi network health emi card reviews,https://www.bajajfinserv.in/emi-network-health-emi-card-reviews
how to clear credit card debt with personal loan,https://www.bajajfinserv.in/how-to-clear-credit-card-debt-with-personal-loan
personal trip effects insurance cover pstp,https://www.bajajfinserv.in/personal-trip-effects-insurance-cover-pstp
credit card reviews,https://www.bajajfinserv.in/credit-card-reviews
shop online zebrs,https://www.bajajfinserv.in/shop-online-zebrs
how to pay credit card bill through imps,https://www.bajajfinserv.in/how-to-pay-credit-card-bill-through-imps
engineer loan,https://www.bajajfinserv.in/engineer-loan
bajaj finserv partners,https://www.bajajfinserv.in/bajaj-finserv-partners
pre approved offers eligibility,https://www.bajajfinserv.in/pre-approved-offers-eligibility
emi network lloyd washing machines,https://www.bajajfinserv.in/emi-network-lloyd-washing-machines
rbl bank platinum life easy supercard,https://www.bajajfinserv.in/rbl-bank-platinum-life-easy-supercard
how to prepare your organisation for a business loan,https://www.bajajfinserv.in/insights/how-to-prepare-your-organisation-for-a-business-loan
the ultimate guide to getting a personal loan for travel,https://www.bajajfinserv.in/insights/the-ultimate-guide-to-getting-a-personal-loan-for-travel
how to apply for bajaj finserv emi network card,https://www.bajajfinserv.in/how-to-apply-for-bajaj-finserv-emi-network-card
smart things to know about credit card payment using nach facility,https://www.bajajfinserv.in/insights/smart-things-to-know-about-credit-card-payment-using-nach-facility
credit card bill payment 4 things you must know,https://www.bajajfinserv.in/insights/credit-card-bill-payment-4-things-you-must-know
how can i get credit card without a bank account,https://www.bajajfinserv.in/how-can-i-get-credit-card-without-a-bank-account
emi network appliances,https://www.bajajfinserv.in/emi-network-appliances
all you need to know about a personal loan for travel,https://www.bajajfinserv.in/insights/all-you-need-to-know-about-a-personal-loan-for-travel
fixed deposit faq questions,https://www.bajajfinserv.in/fixed-deposit-faq-questions
emi network nikon camera,https://www.bajajfinserv.in/emi-network-nikon-camera
domestic travel insurance faqs,https://www.bajajfinserv.in/domestic-travel-insurance-faqs
how to get loan on credit card,https://www.bajajfinserv.in/insights/how-to-get-loan-on-credit-card
personal loan processing fees and interest rates,https://www.bajajfinserv.in/personal-loan-processing-fees-and-interest-rates
pocket insurance application form,https://www.bajajfinserv.in/pocket-insurance-application-form
apply for credit card,https://www.bajajfinserv.in/videos/apply-for-credit-card
chartered accountant loan application form,https://www.bajajfinserv.in/chartered-accountant-loan-application-form
8 costs to keep in mind while planning your wedding,https://www.bajajfinserv.in/insights/8-costs-to-keep-in-mind-while-planning-your-wedding
6 types of supercard for every lifestyle and need,https://www.bajajfinserv.in/insights/6-types-of-supercard-for-every-lifestyle-and-need
what is personal loan overdraft facility,https://www.bajajfinserv.in/what-is-personal-loan-overdraft-facility
gold loan,https://www.bajajfinserv.in/gold-loan
emi network allen career institute,https://www.bajajfinserv.in/emi-network-allen-career-institute
unsecured loans,https://www.bajajfinserv.in/unsecured-loans
how to apply for a credit card online in 3 steps,https://www.bajajfinserv.in/insights/how-to-apply-for-a-credit-card-online-in-3-steps
interest calculator,https://www.bajajfinserv.in/interest-calculator
how do you ensure that you have a good credit score,https://www.bajajfinserv.in/how-do-you-ensure-that-you-have-a-good-credit-score
collateral free business loans,https://www.bajajfinserv.in/collateral-free-business-loans
bajaj finserv wallet digital emi network card,https://www.bajajfinserv.in/bajaj-finserv-wallet-digital-emi-network-card
car insurance frequently asked questions,https://www.bajajfinserv.in/car-insurance-frequently-asked-questions
shop online yatra,https://www.bajajfinserv.in/shop-online-yatra
emi network lava mobiles,https://www.bajajfinserv.in/emi-network-lava-mobiles
tackle credit card debt with a personal loan for debt conso,https://www.bajajfinserv.in/insights/tackle-credit-card-debt-with-a-personal-loan-for-debt-conso
how to check bajaj finserv personal loan statement,https://www.bajajfinserv.in/how-to-check-bajaj-finserv-personal-loan-statement
emi network electronics on emi,https://www.bajajfinserv.in/emi-network-electronics-on-emi
fixed deposit fees and interest rates,https://www.bajajfinserv.in/fixed-deposit-fees-and-interest-rates
road trip travel insurance policy,https://www.bajajfinserv.in/road-trip-travel-insurance-policy
business,https://www.bajajfinserv.in/insights/business
emi network hafele india,https://www.bajajfinserv.in/emi-network-hafele-india
things you can do to improve your personal credit score,https://www.bajajfinserv.in/insights/things-you-can-do-to-improve-your-personal-credit-score
home loan balance transfer application form,https://www.bajajfinserv.in/home-loan-balance-transfer-application-form
what information do you need to apply for a business loan,https://www.bajajfinserv.in/insights/what-information-do-you-need-to-apply-for-a-business-loan
what to do if your business credit score is low,https://www.bajajfinserv.in/insights/what-to-do-if-your-business-credit-score-is-low
emi network vu tv,https://www.bajajfinserv.in/emi-network-vu-tv
emi network emi card contact details,https://www.bajajfinserv.in/emi-network-emi-card-contact-details
moratorium calculator personal loan,https://www.bajajfinserv.in/moratorium-calculator-personal-loan
can you apply for a personal loan for travel,https://www.bajajfinserv.in/insights/can-you-apply-for-a-personal-loan-for-travel
personal loan up to 25 lakh only with bajaj finserv,https://www.bajajfinserv.in/insights/personal-loan-up-to-25-lakh-only-with-bajaj-finserv
home loan application,https://www.bajajfinserv.in/home-loan-application
a luxury vacation to ladakh is now within reach,https://www.bajajfinserv.in/insights/a-luxury-vacation-to-ladakh-is-now-within-reach
term loan calculator,https://www.bajajfinserv.in/term-loan-calculator
what is foir how it affect personal loan approval,https://www.bajajfinserv.in/what-is-foir-how-it-affect-personal-loan-approval
life insurance child plans,https://www.bajajfinserv.in/life-insurance-child-plans
emi network ica courses,https://www.bajajfinserv.in/emi-network-ica-courses
shop on ecommerce airtel,https://www.bajajfinserv.in/shop-on-ecommerce-airtel
wallet protect card protection insurance plan,https://www.bajajfinserv.in/wallet-protect-card-protection-insurance-plan
check pre approved ca loan offer,https://www.bajajfinserv.in/check-pre-approved-ca-loan-offer
why working capital finance is necessary for small businesses,https://www.bajajfinserv.in/insights/why-working-capital-finance-is-necessary-for-small-businesses
insurance policies in india,https://www.bajajfinserv.in/insurance-policies-in-india
income tax calculator,https://www.bajajfinserv.in/income-tax-calculator
fixed deposit reviews,https://www.bajajfinserv.in/fixed-deposit-reviews
how to convert slow moving and excess inventory into cash,https://www.bajajfinserv.in/insights/how-to-convert-slow-moving-and-excess-inventory-into-cash
no cost emi on makemytrip,https://www.bajajfinserv.in/no-cost-emi-on-makemytrip
two and three wheeler loan,https://www.bajajfinserv.in/two-and-three-wheeler-loan
dance accident insurance,https://www.bajajfinserv.in/dance-accident-insurance
what is the interest rate for credit card cash withdrawal,https://www.bajajfinserv.in/what-is-the-interest-rate-for-credit-card-cash-withdrawal
business loan application form,https://www.bajajfinserv.in/business-loan-application-form
umm qais to the red sea explore the jordan trail for just 5 lakh,https://www.bajajfinserv.in/insights/umm-qais-to-the-red-sea-explore-the-jordan-trail-for-just-5-lakh
home protection insurance cover pstp,https://www.bajajfinserv.in/home-protection-insurance-cover-pstp
covid 19 symptoms preventions and treatment,https://www.bajajfinserv.in/covid-19-symptoms-preventions-and-treatment
low brokerage trading and demat account,https://www.bajajfinserv.in/low-brokerage-trading-and-demat-account
emi network lloyd television,https://www.bajajfinserv.in/emi-network-lloyd-television
emi network mens fashion on emi,https://www.bajajfinserv.in/emi-network-mens-fashion-on-emi
what is a credit card,https://www.bajajfinserv.in/what-is-a-credit-card
loan against fixed deposit faq questions,https://www.bajajfinserv.in/loan-against-fixed-deposit-faq-questions
know all about pre approved personal loans,https://www.bajajfinserv.in/insights/know-all-about-pre-approved-personal-loans
how outstanding debt affects your credit score,https://www.bajajfinserv.in/insights/how-outstanding-debt-affects-your-credit-score
stampede insurance pstp,https://www.bajajfinserv.in/stampede-insurance-pstp
business loan,https://www.bajajfinserv.in/business-loan
emi network printers on emi,https://www.bajajfinserv.in/emi-network-printers-on-emi
personal loan preapproved loan offer,https://www.bajajfinserv.in/personal-loan-preapproved-loan-offer
emi network hitachi refrigerator,https://www.bajajfinserv.in/emi-network-hitachi-refrigerator
loan against car,https://www.bajajfinserv.in/videos/loan-against-car
emi network tcl televisions,https://www.bajajfinserv.in/emi-network-tcl-televisions
how to easily get a collateral free business loan,https://www.bajajfinserv.in/insights/how-to-easily-get-a-collateral-free-business-loan
basic requirements to get a business loan,https://www.bajajfinserv.in/insights/basic-requirements-to-get-a-business-loan
loan against securities app form,https://www.bajajfinserv.in/loan-against-securities-app-form
emi network womens fashion on emi,https://www.bajajfinserv.in/emi-network-womens-fashion-on-emi
25000 personal loan,https://www.bajajfinserv.in/25000-personal-loan
how you can benefit from flexi personal loans,https://www.bajajfinserv.in/insights/how-you-can-benefit-from-flexi-personal-loans
pay with supercard points,https://www.bajajfinserv.in/pay-with-supercard-points
equipment machinery loan emi calculator,https://www.bajajfinserv.in/equipment-machinery-loan-emi-calculator
ways to pay credit card bill payment by cheque,https://www.bajajfinserv.in/insights/ways-to-pay-credit-card-bill-payment-by-cheque
business loan for women,https://www.bajajfinserv.in/business-loan-for-women
make a wish campaign,https://www.bajajfinserv.in/make-a-wish-campaign
how to get credit card,https://www.bajajfinserv.in/how-to-get-credit-card
rbl bank doctor supercard,https://www.bajajfinserv.in/rbl-bank-doctor-supercard
what is corporate card,https://www.bajajfinserv.in/insights/what-is-corporate-card
personal loan part pre payment calculator,https://www.bajajfinserv.in/personal-loan-part-pre-payment-calculator
how to ensure your business cibil score stays above 700,https://www.bajajfinserv.in/insights/how-to-ensure-your-business-cibil-score-stays-above-700
healthcare services by bajaj finserv health,https://www.bajajfinserv.in/healthcare-services-by-bajaj-finserv-health
emi network whirlpool washing machine,https://www.bajajfinserv.in/emi-network-whirlpool-washing-machine
features and benefits of bajaj finserv emi reduction offer,https://www.bajajfinserv.in/insights/features-and-benefits-of-bajaj-finserv-emi-reduction-offer
secured loans vs unsecured loans which one should you go for,https://www.bajajfinserv.in/insights/secured-loans-vs-unsecured-loans-which-one-should-you-go-for
cibil login id password,https://www.bajajfinserv.in/insights/cibil-login-id-password
how to calculate personal loan emis,https://www.bajajfinserv.in/insights/how-to-calculate-personal-loan-emis
how to get an instant loan against securities from bajaj finserv,https://www.bajajfinserv.in/insights/how-to-get-an-instant-loan-against-securities-from-bajaj-finserv
camparison with other investments,https://www.bajajfinserv.in/videos/camparison-with-other-investments
rental deposit loan,https://www.bajajfinserv.in/rental-deposit-loan
corporate bajaj housing finance limited bhfl,https://www.bajajfinserv.in/corporate-bajaj-housing-finance-limited-bhfl
flexi personal loan or a term loan what do i choose if i want to travel,https://www.bajajfinserv.in/insights/flexi-personal-loan-or-a-term-loan-what-do-i-choose-if-i-want-to-travel
emi network mattress on emi,https://www.bajajfinserv.in/emi-network-mattress-on-emi
when is the best time to get a business loan,https://www.bajajfinserv.in/insights/when-is-the-best-time-to-get-a-business-loan
two and three wheeler loan,https://www.bajajfinserv.in/insights/two-and-three-wheeler-loan
what is the typical personal loan amount and repayment tenure,https://www.bajajfinserv.in/what-is-the-typical-personal-loan-amount-and-repayment-tenure
emi network iball laptops,https://www.bajajfinserv.in/emi-network-iball-laptops
fixed deposits for child future,https://www.bajajfinserv.in/fixed-deposits-for-child-future
cibil charges in india,https://www.bajajfinserv.in/insights/cibil-charges-in-india
everything you should know about the fees and charges applicable on your personal loan,https://www.bajajfinserv.in/insights/everything-you-should-know-about-the-fees-and-charges-applicable-on-your-personal-loan
what is working capital,https://www.bajajfinserv.in/what-is-working-capital
emi network voltas air conditioners,https://www.bajajfinserv.in/emi-network-voltas-air-conditioners
disclaimer page,https://www.bajajfinserv.in/disclaimer-page
what is letter of continuity,https://www.bajajfinserv.in/what-is-letter-of-continuity
how to plan a trip to tomorrowland on a budget,https://www.bajajfinserv.in/insights/how-to-plan-a-trip-to-tomorrowland-on-a-budget
emi network haier led tv,https://www.bajajfinserv.in/emi-network-haier-led-tv
how to start online trading,https://www.bajajfinserv.in/insights/how-to-start-online-trading
credit card statement,https://www.bajajfinserv.in/credit-card-statement
emi network lg refrigerator,https://www.bajajfinserv.in/emi-network-lg-refrigerator
fixed deposit contact us,https://www.bajajfinserv.in/fixed-deposit-contact-us
access your bajaj finserv rbl bank supercard easily using the rbl mycard app,https://www.bajajfinserv.in/insights/access-your-bajaj-finserv-rbl-bank-supercard-easily-using-the-rbl-mycard-app
rbl bank platinum plus fyf supercard,https://www.bajajfinserv.in/rbl-bank-platinum-plus-fyf-supercard
personal loan faq questions,https://www.bajajfinserv.in/personal-loan-faq-questions
loan against property,https://www.bajajfinserv.in/insights/loan-against-property
invoice financing,https://www.bajajfinserv.in/invoice-financing
e aadhaar card all you wanted to know,https://www.bajajfinserv.in/insights/e-aadhaar-card-all-you-wanted-to-know
live in the quirkiest hotels across the world under 7 lakh,https://www.bajajfinserv.in/insights/live-in-the-quirkiest-hotels-across-the-world-under-7-lakh
rbl bank platinum edge supercard,https://www.bajajfinserv.in/rbl-bank-platinum-edge-supercard
complete these 5 steps to download your e aadhaar card,https://www.bajajfinserv.in/insights/complete-these-5-steps-to-download-your-e-aadhaar-card
open extended warranty,https://www.bajajfinserv.in/open-extended-warranty
types of credit card,https://www.bajajfinserv.in/types-of-credit-card
how to get a personal loan when you have a bad cibil score,https://www.bajajfinserv.in/insights/how-to-get-a-personal-loan-when-you-have-a-bad-cibil-score
business loan faq questions,https://www.bajajfinserv.in/business-loan-faq-questions
health insurance,https://www.bajajfinserv.in/health-insurance
emi network onida washing machine,https://www.bajajfinserv.in/emi-network-onida-washing-machine
emi network dell laptop,https://www.bajajfinserv.in/emi-network-dell-laptop
equipment machinery loan,https://www.bajajfinserv.in/equipment-machinery-loan
emi network poorvika mobiles,https://www.bajajfinserv.in/emi-network-poorvika-mobiles
emi network lifecare services at drbatra,https://www.bajajfinserv.in/emi-network-lifecare-services-at-drbatra
asset care faq questions,https://www.bajajfinserv.in/asset-care-faq-questions
professional indemnity insurance policy for doctors,https://www.bajajfinserv.in/professional-indemnity-insurance-policy-for-doctors
track credit card application status,https://www.bajajfinserv.in/track-credit-card-application-status
kyc status,https://www.bajajfinserv.in/insights/kyc-status
how to redeem and use credit card reward points,https://www.bajajfinserv.in/how-to-redeem-and-use-credit-card-reward-points
emi network air cooler on emi,https://www.bajajfinserv.in/emi-network-air-cooler-on-emi
sdp single maturity plan calculator,https://www.bajajfinserv.in/sdp-single-maturity-plan-calculator
how can i get credit card for the first time,https://www.bajajfinserv.in/how-can-i-get-credit-card-for-the-first-time
how are personal loan applications processed,https://www.bajajfinserv.in/insights/how-are-personal-loan-applications-processed
covid 19 protection cover,https://www.bajajfinserv.in/covid-19-protection-cover
store locator old,https://www.bajajfinserv.in/store-locator-old
5 things to do with your credit card reward points,https://www.bajajfinserv.in/insights/5-things-to-do-with-your-credit-card-reward-points
super card,https://www.bajajfinserv.in/super-card
business loan reviews,https://www.bajajfinserv.in/business-loan-reviews
unique benefits of business financing by bajaj finserv,https://www.bajajfinserv.in/insights/unique-benefits-of-business-financing-by-bajaj-finserv
how to experience the northern lights at the exotic arctic resort within 5 lakh,https://www.bajajfinserv.in/insights/how-to-experience-the-northern-lights-at-the-exotic-arctic-resort-within-5-lakh
mistakes to avoid when managing working capital for your business,https://www.bajajfinserv.in/insights/mistakes-to-avoid-when-managing-working-capital-for-your-business
how business loans help you successfully implement a big project,https://www.bajajfinserv.in/insights/how-business-loans-help-you-successfully-implement-a-big-project
womens footwear on easy emis,https://www.bajajfinserv.in/womens-footwear-on-easy-emis
